review_date,review_text,review_rate,review_hotel,review_source
2024-01-21,"早餐美式可以在多樣化,吐司跟培根烤太焦無",10,兄弟大飯店,Booking.com
2024-01-21,早餐餐點,10,兄弟大飯店,Booking.com
2024-01-21,地理位置很方便，附近也很熱鬧，員工親切服務好,10,兄弟大飯店,Booking.com
2024-01-21,飯店氛圍很好也乾淨衛浴空間太小 早餐環境不是很乾淨,10,兄弟大飯店,Booking.com
2024-01-21,都好,10,兄弟大飯店,Booking.com
2024-01-10,早餐的品質不錯～種類不多，但口味佳；交通位置也很好房間吹風機風量太小。早餐用到10:00，原來是指用餐時段⋯建議詳細與顧客說明。我以為取餐完可以再坐一下，結果10:20被趕。,10,兄弟大飯店,Booking.com
2024-01-10,住宿地點好雖然房間被升級，但是剛好在餐廳下面的樣子，整個晚上都在聽樓上高跟鞋走來走去，非常吵，到接近午夜才停止。,10,兄弟大飯店,Booking.com
2023-12-28,位置方便，店內及附近吃的東西很多入住當天晚上跟櫃臺人員要求換信用卡付款，可能是男主管，臉色不好+語氣不佳，我們只能忍氣吞聲,10,兄弟大飯店,Booking.com
2023-12-28,非常溫馨舒適的房間，員工貼心服務，特別是以Room service好吃的鹹蛋苦瓜和地瓜粥，讓我下次住宿還會再點room service👍沒有,10,兄弟大飯店,Booking.com
2023-12-28,位置，服务，早餐check-in柜台女士有点仓促，但是可以理解,10,兄弟大飯店,Booking.com
2023-12-21,交通非常便利隔音稍差一點,10,兄弟大飯店,Booking.com
2023-12-21,地點很好，服務很好，房間很乾凈，設備齊全浴缸的突出式排水孔不小心的話會讓腳指受傷,10,兄弟大飯店,Booking.com
2023-12-21,"因為參加馬拉松而延遲退房,耽誤一些時間,飯店沒有沒有怨言也沒多收費,僅細心說明下回注意,若可以早一點會更好,整體服務優質,較通方便離捷運僅10m,是我下次旅遊的首選!無",10,兄弟大飯店,Booking.com
2023-12-21,厠所有毛髮,10,兄弟大飯店,Booking.com
2023-12-21,"早上需要叫車，天氣很冷，又封路
員工一路陪同到馬路口等計程車
到了叫到車才離開，很負責牙刷有一副是上一位客人拆過沒注意到留下來的",10,兄弟大飯店,Booking.com
2023-12-13,住宿店點沒話說，捷運和公車非常方便，往來各個地點都很輕鬆，附近商店足夠、飯店本身的食物也很優秀，因為住兩天的關係，體驗了樓上和一樓的早餐各一，無論是自助、或套餐服務的早餐都很不錯，飯店周遭雖然看似熱鬧，但夜晚安靜，一個人住來說很舒適。可以想到的缺點是住宿提供的牙刷品質不太好，一直掉毛，櫃台不是很顯眼，入住辦理的速度有點慢。,10,兄弟大飯店,Booking.com
2023-11-30,早餐豐盛 交通方便樓下的人想上樓太容易 沒有安全感 服務台也沒有查實 希望加強控管入住戶的安全 這也是贵飯店提高安全品質的重要問題! 下次再回來希望看到貴店的改善！,10,兄弟大飯店,Booking.com
2023-11-30,位置四通八達，很棒沒有,10,兄弟大飯店,Booking.com
2023-11-13,飯店工作人員服務好、早餐好吃、床與枕頭舒適沐浴精提供的量不太足、總覺得房間跟booking.com顯示的訂房圖片不一樣,10,兄弟大飯店,Booking.com
2023-11-13,地點超級方便，也很方便排隊吃兄弟飯店的港點飲茶。床很小，只有一個小氣窗，早餐比較傳統,10,兄弟大飯店,Booking.com
2023-10-19,"因為去聽演唱會所以來住這邊
因為飯店比較久了所以整體來說中規中矩
房間沒有到很大，但也夠用
早上選了樓上中式吃到飽，有點普通
有演唱會需求的話可以推薦喔",10,兄弟大飯店,Booking.com
2023-10-19,早餐不錯，服務也很好,10,兄弟大飯店,Booking.com
2023-10-15,房間配置，房型大小，燈光，衣櫃，員工專業，早餐好吃。無,10,兄弟大飯店,Booking.com
2023-10-15,價格高.房間不優.早餐令人失望,10,兄弟大飯店,Booking.com
2023-10-07,StaffParking,10,兄弟大飯店,Booking.com
2023-09-26,地點超讚一出南京復興捷運站就到！早餐多樣選擇,10,兄弟大飯店,Booking.com
2023-09-26,被子太厚,10,兄弟大飯店,Booking.com
2023-09-26,床很舒適好躺而且夠大,10,兄弟大飯店,Booking.com
2023-09-11,星期五晚上8點半check-in，原本預訂的單人房客滿，免費升等雙人房13樓早餐buffet普普，選擇不多,10,兄弟大飯店,Booking.com
2023-09-11,"早餐基本盤 偏中式多,咖啡機2台速度算快,法式吐司不錯房型空間感 電視換50吋會好些,但是飯店人龍混雜比較沒有安全感,房客 吃客都很難分流,住宿樓層貌似大家都可以進",10,兄弟大飯店,Booking.com
2023-09-03,交通便利，早餐多元，對於客人詢問回應迅速！,10,兄弟大飯店,Booking.com
2023-08-26,地理位置超方便一樓大廳有些熱，訂飯店的餐廳，房客竟然沒有優惠😱,10,兄弟大飯店,Booking.com
2023-08-16,Good,10,兄弟大飯店,Booking.com
2023-08-16,餐點選擇多，離捷運近，位置方便停車位太窄，高度被風管影響，休旅車後車廂門不小心容易碰撞。,10,兄弟大飯店,Booking.com
2023-08-13,ㄈㄤ,10,兄弟大飯店,Booking.com
2023-08-07,Good,10,兄弟大飯店,Booking.com
2023-08-07,早餐非常好吃,10,兄弟大飯店,Booking.com
2023-08-02,浴缸有髒東西,10,兄弟大飯店,Booking.com
2023-08-02,"。住雙人大床房
。房間大小得宜
。床很大很好睡
。晚上非常安靜
。交通非常便利
。早餐選擇性多無",10,兄弟大飯店,Booking.com
2023-08-02,Breakfast浴巾太短 沐浴乳洗髮精偏少,10,兄弟大飯店,Booking.com
2023-08-02,"地點非常棒，南京復興站六號出口就到。
二樓港式飲茶蠻好吃，生意也很好；一樓也有麵包坊和壽司飯丸提供選擇。飯店附近餐廳也不少。
飯店附近有超商、百貨、服飾各種店都有，購物方便。
服務人員很親切，外語能力還不錯。飯店生意太好，退房需要排隊（人多時需要等蠻久）。
建議飯店週末早上辦理退房可以增加人手幫忙，或者假如住客趕時間的話就提早退房、避開接近 11 點的尖峰時段吧。",10,兄弟大飯店,Booking.com
2023-07-27,地點很好早餐有點簡單,10,兄弟大飯店,Booking.com
2023-07-27,一樓的商店、壽司飯丸及麵包都有不錯的特色商品，價位也便宜。,10,兄弟大飯店,Booking.com
2023-07-27,位置優異 客房重新整裝很舒適早餐普通,10,兄弟大飯店,Booking.com
2023-07-16,餐點佳，選擇多，服務親切，環境整潔停車位子太侷限，高度低，若沒注意到，休旅車後車廂門開啓會碰撞到風管。建議停車時需特別提醒駕駛。,10,兄弟大飯店,Booking.com
2023-07-16,交通很方便，又有停車場，早餐很豐盛,10,兄弟大飯店,Booking.com
2023-07-16,一樓的壽司飯丸,10,兄弟大飯店,Booking.com
2023-07-09,早餐選項滿十分豐富，如果有再多一點雞胸肉或是鮭魚幫助有在健身的人會更好。枕頭偏軟了一點。,10,兄弟大飯店,Booking.com
2023-07-03,"一進門就有服務人員接待，幫忙按電梯。櫃台人員都很親切。我在第一天晚上不小心遺失房卡，結果櫃檯人員說不用工本費，就再給我一張新的，真的很感謝TT
單人房的空間非常足夠，床很大很舒適，浴室很乾淨，可以把保養品化妝品都擺出來，而且我發現竟然有220V的插座，一般去國外旅遊都很少看到有提供110V的插座，真的很貼心。希望有提供投幣式自助洗衣",10,兄弟大飯店,Booking.com
2023-07-03,"地點很優秀，捷運站位於旁邊，往返松山機場很方便。
冰箱裡提供多種飲品。沒有特別不滿的地方。",10,兄弟大飯店,Booking.com
2023-06-25,"房務員很有禮貌很用心。
房間設計非常好，空間大、有充足的設備放行李/坐坐/整理行李等。
沙發很舒服，書桌很寬，照明充足。
玄關設計很好，放水和熱水壺的小櫃子很可愛。
洗手盆枱面和櫃子好用、乾淨，鏡子和浴室的照明很好，地磚也不會滑腳。
整個房間與樓層的室內設計與 earth tone 用色很優雅舒服，牆紙的質感紋理給人安靜高貴的感覺。
衣架數量充足，傳統酒店有的配給如鞋刷、拖鞋、污衣袋等應有盡有，就算自己沒有使用，也很感受到管理人員的貼心關懷。
香皂與沐浴用品味道清幽又好用，花灑頭非常舒服，水壓充足，也是一讚！
門鎖設計讓人安心。
服務人員積極而快速回覆我們的查詢，並貼心地為我們提供洗浴小凳。
早餐不錯。
The housekeepers are very polite and considerate.
Design of the room is very good, spacious, and there are sufficient equipment to spread out your luggage/ to sit on/ to tidy up your stuff, etc.
Sofa with footstool is comfortable. The desk is wide and well lit.
The porch is also well designed, and the small cabinet for water bottle and kettle is cute.
The vanity top and cabinets are functional and clean. The mirror and bathroom lighting are good, and the floor tiles are not slippery.
The interior design and earth tone color of the entire room, corridor, hall way are elegant and comfortable. The texture of the wallpaper gives a quiet and noble feeling.
The number of cloth hangers is sufficient, and the small items that are provided by traditional hotels such as shoe brushes, slippers, and dirty clothes bags are also found in the closet. Even if you don't use them, the care and thoughtfulnessfrom the management staff are obviously shown.
The soap and bath items are good and smell great, good shower head with strong water which is also a credit!
The door lock design is reassuring.
The staff responded instantly and nicely provided a shower stool as required.
Good breakfast.浴缸太高。家母年過80，雖然已有小凳，出入仍然吃力。",10,兄弟大飯店,Booking.com
2023-06-25,"床很棒
早餐好吃",10,兄弟大飯店,Booking.com
2023-06-25,超喜歡兄弟飯店，位置在捷運旁，飯店乾淨，服務人員親切，本來預約單人房，當天還升等到雙人房，雖然還是一人住，但空間大些，更舒服，CP值超高，大推兄弟飯店給來台北的人喔！,10,兄弟大飯店,Booking.com
2023-06-19,可惜地下停車限制高度,10,兄弟大飯店,Booking.com
2023-06-12,交通便利,10,兄弟大飯店,Booking.com
2023-06-12,中市早餐多樣，也可選西式無,10,兄弟大飯店,Booking.com
2023-06-07,交通方便櫃檯人員冷淡,10,兄弟大飯店,Booking.com
2023-06-07,早餐的環境可以再改善，座位排得太接近；餐廳員工動作有點粗魯，收放餐具聲音太大。,10,兄弟大飯店,Booking.com
2023-06-07,早餐多樣化，味增湯相當好喝，房間相當乾淨，裝潢也很新無,10,兄弟大飯店,Booking.com
2023-06-01,員工很親切，房間整修過整體乾淨舒適，餐點好吃。安排在內側，房間有對外窗但很暗，房間不方整，空間不大。,10,兄弟大飯店,Booking.com
2023-05-24,"地理位置很好！飯店門口就是捷運站
走路即可到小巨蛋 跟百貨公司
2樓的梅花廳港式飲茶好吃😋",10,兄弟大飯店,Booking.com
2023-05-24,"位置就在捷運站旁邊, 非常方便, 附近很多好吃的, 飯店本身也有餐廳, 選擇很多!",10,兄弟大飯店,Booking.com
2023-05-24,￼位置很好，很方￼便早餐的豐富度不夠,10,兄弟大飯店,Booking.com
2023-05-24,位置很好，南京復興站出口就是飯店，附近餐廳很多，又有便利商店，十分方便.早餐很普通，因為是假日，所以客人很多，食材很快就被拿完了.,10,兄弟大飯店,Booking.com
2023-05-16,整體來說都很滿意沒有不滿意的地方,10,兄弟大飯店,Booking.com
2023-05-16,早餐素食菜色較少還可以接受，非素食菜色豐盛。服務態度很好。,10,兄弟大飯店,Booking.com
2023-05-08,工作人員很親切，一樓有麵包店，壽司飯糰店，看演唱會前可以買來充飢，超級方便。,10,兄弟大飯店,Booking.com
2023-05-08,住宿位置,10,兄弟大飯店,Booking.com
2023-05-08,枕頭太軟。,10,兄弟大飯店,Booking.com
2023-05-02,早餐款式尚可，若能有更多變化更好。,10,兄弟大飯店,Booking.com
2023-05-02,房間設備非常齊全，尤其是有浴缸冷氣風扇無法調整，永遠都是最大風量，聲音有點大聲，最後是關掉冷氣，才睡得著。,10,兄弟大飯店,Booking.com
2023-05-02,良好的房型 廣大的房間 極其友善的服務人員浴室不是分離式的,10,兄弟大飯店,Booking.com
2023-04-29,不會太軟的床，床的軟硬度非常好冷氣不知道如何調整,10,兄弟大飯店,Booking.com
2023-04-29,房間乾淨，服務人員專業、客氣、有禮貌。沒有,10,兄弟大飯店,Booking.com
2023-04-21,地點佳因較晚退房，不知是樓上還是隔壁房在清潔房間，移動傢俱的聲音讓人無法好好休息,10,兄弟大飯店,Booking.com
2023-04-21,早餐棒極了！有各式選擇，中式料理、西式生菜品質很好，而且美味，蔬菜、蛋白質的質與量都很充足，服務也很好,10,兄弟大飯店,Booking.com
2023-04-21,位置環境好,10,兄弟大飯店,Booking.com
2023-04-21,無可挑剔，服務人員親切無,10,兄弟大飯店,Booking.com
2023-04-16,早餐好吃 床很舒服,10,兄弟大飯店,Booking.com
2023-04-16,"位置真的超讚
翻新過之後房間雖然不算大但乾淨舒適
整個飯店很有和洋氛圍",10,兄弟大飯店,Booking.com
2023-04-16,乾淨。周邊伴手禮，麵包店很熱鬧無,10,兄弟大飯店,Booking.com
2023-04-10,有地下停車場，車放樓下走出門就是捷運站，交通位罝非常方便；浴室沒有乾濕分離，洗過澡後地磚都是滑的，只有一張止滑墊不夠，小朋友有在裡面跌倒摔哭。,10,兄弟大飯店,Booking.com
2023-04-10,🛀🏻🈚️,10,兄弟大飯店,Booking.com
2023-04-10,飯店位子就在捷運站旁，很方便活動，員工服務好，早餐選擇多樣,10,兄弟大飯店,Booking.com
2023-04-10,飯店外觀及客房內部都很乾淨，也沒有菸味。工作人員態度都很親切。飯店有很多形式的餐廳，一樓販賣也很多樣化，光是飯糰我就吃了兩天。,10,兄弟大飯店,Booking.com
2023-04-04,交通太方便。附近餐廳、百貨公司聚集，想逛街不怕沒地方逛。飯店房間的插座多，其他備品應有盡有，早餐豐富。枕頭太軟，第四台不夠穩定，希望有自助洗衣設備。,10,兄弟大飯店,Booking.com
2023-04-04,地毯接待櫃檯員工,10,兄弟大飯店,Booking.com
2023-04-04,"地段真的不錯交通機能上非常方便房間內的雙人床真的有點小，不太適合兩個人睡
床墊也比較軟，睡起來不太舒服。",10,兄弟大飯店,Booking.com
2023-04-03,離捷運很近地毯棉絮,10,兄弟大飯店,Booking.com
2023-04-03,很棒,10,兄弟大飯店,Booking.com
2023-04-03,飯店位置交通方便,10,兄弟大飯店,Booking.com
2023-04-03,氣氛很好浴缸有一層油,10,兄弟大飯店,Booking.com
2023-03-26,服務人員很親切，房間也很舒適。隔音有點差,10,兄弟大飯店,Booking.com
2023-03-26,地點好，餐廳多。退房時截止落在飯店，後來發現打電話去飯店詢問才得知好心的服務人員已經自行幫我包好。非常棒的服務！無,10,兄弟大飯店,Booking.com
2023-03-02,住宿環境棒，交通便利,10,兄弟大飯店,Booking.com
2023-03-02,乾淨舒適的房間，便利的交通位置，好吃的港式茶餐廳停車場停車位太少，要跟來用餐的人排隊等車位,10,兄弟大飯店,Booking.com
2023-03-02,"交通便利在捷運旁
美食多無",10,兄弟大飯店,Booking.com
2023-03-02,房間乾淨度休閒設備太少,10,兄弟大飯店,Booking.com
2023-02-27,地點好，交通便捷，房間整體乾淨。沒有,10,兄弟大飯店,Booking.com
2023-02-27,以前只有到飯店的餐廳消費過，本來以為房間也會有年代感，沒想到住宿設備非常新也非常舒適！,10,兄弟大飯店,Booking.com
2023-02-27,位置，參加小巨蛋演唱會住宿好選擇沒有,10,兄弟大飯店,Booking.com
2023-02-27,春節北返選擇兄弟是第3次了，不管交通位置或美食，真的很棒！,10,兄弟大飯店,Booking.com
2023-02-27,早餐很棒，可以選擇高樓層自助餐或套餐式餐廳。套餐式餐廳聽說供應到11點，只吃了自助餐很滿意，蠻標準的中西式自助早餐。房間住宿乾淨舒適。地點方便。避開用餐時間的話，停車場十分方便。免治馬桶對大屁股並不友善。,10,兄弟大飯店,Booking.com
2023-02-20,"飯店隔壁即是捷運站、有停車位、
附近生活品質佳、買東西很方便。連續住宿三天，早餐內容差不多。",10,兄弟大飯店,Booking.com
2023-02-20,地點佳 交通便捷 周邊店家很多可以逛逛 客房鬧中取靜 很乾淨 會在此到訪隔音稍嫌美中不足,10,兄弟大飯店,Booking.com
2023-02-20,人房間味道 好像廁所有不流通,10,兄弟大飯店,Booking.com
2023-02-20,地點佳！無,10,兄弟大飯店,Booking.com
2023-02-13,整體乾淨、房間設備齊全，還有免治馬桶雖然沒有保證有停車位，不過我在用餐離峰時段去還是排了一個小時☹️，搭車是最好的交通方式,10,兄弟大飯店,Booking.com
2023-02-13,地點不錯最好提早去辦理check out，否則只有2個人員辦理，會大排長龍,10,兄弟大飯店,Booking.com
2023-02-13,早餐樣式多款，地點佳，機能好,10,兄弟大飯店,Booking.com
2023-02-13,清潔沒有,10,兄弟大飯店,Booking.com
2023-02-06,裝潢很新，應有盡有早餐服務人員似乎不足，櫃檯員工太忙,10,兄弟大飯店,Booking.com
2023-02-06,飯店人員很打掃房間很用心裡面飲茶餐廳服務態度差,10,兄弟大飯店,Booking.com
2023-01-30,各方面都很滿意無,10,兄弟大飯店,Booking.com
2023-01-30,早餐選擇多樣化，不因為春節人多影響服務態度。退房後物品遺漏在房間向櫃台反應，相關單位立即處理。無,10,兄弟大飯店,Booking.com
2023-01-30,服務人員皆親切有禮，餐飲美味隔音稍差，聽得到隔壁房間的打噴嚏聲及樓上房間的跑跳聲,10,兄弟大飯店,Booking.com
2023-01-26,"地點就在捷運站旁，如需補充日常用品，旁便走幾步就是大創百貨。
房間內靠牆的位置有設計一條長長的置物平台，放東西或小件行李超實用!!
早餐是中西式自助餐，內容豐富，味增湯很棒。餐廳的接待人員也非常親切，不會讓人有壓力不自在的感覺。浴室的門是鐵製的，邊邊是尖角，入住期間曾不小心關門時被劃到導致腳趾破皮。建議可以在門的下方邊角處裝護墊包住。",10,兄弟大飯店,Booking.com
2023-01-26,重新裝潢過的兄弟飯店，舒適度100分！隔音稍差，早餐吧仍有進步空間,10,兄弟大飯店,Booking.com
2023-01-26,空調的聲音有點大聲,10,兄弟大飯店,Booking.com
2023-01-26,位置不錯，捷運方便，附近吃的也很多，服務人員態度很好早餐比較普通，但也吃得飽,10,兄弟大飯店,Booking.com
