review_date,review_text,review_rate,review_hotel,review_source
2024-01-08,"地點好24樓總裁套房~內裝超舊、燈光昏暗、玻璃超髒
16樓101景觀房，灰塵超級多，燈光處厚厚的灰塵，棉絮一直飄
額外要求冰桶要200，一個紅酒杯要50",10,台北君悅酒店,Booking.com
2023-12-25,棉被有酸臭味 通知客房服務換棉被 遲遲不來 等20分鐘以上 還要再打總機崔一次 有夠沒效率 花一萬多的價錢住一晚 真的很不值,10,台北君悅酒店,Booking.com
2023-12-25,入住時間沒有掌控好，三點可入住，但房間卻還沒整理好，影響後續行程,10,台北君悅酒店,Booking.com
2023-12-25,地點方便 但是房間整潔似乎可以再加強枕頭跟床鋪太軟 棉被不夠溫暖 沒有遮光窗簾 早上會被陽光照醒 電熱水壺不夠好用,10,台北君悅酒店,Booking.com
2023-12-25,床軟硬適中很舒服，整體房間舒適無,10,台北君悅酒店,Booking.com
2023-12-25,人員服務親力親為，飯店歷史及地理位置意義甚巨，此次住在高樓層房，看著被霧氣籠罩不見頂的101，感受著社會變動的脈絡無,10,台北君悅酒店,Booking.com
2023-11-18,房間特別大且舒適，五樓的健身房及游泳池特別讚！這次有帶兩個月大的嬰兒一起到早餐用餐，建議一定要預留空間給嬰兒車，如果嫌佔位子，就直接來換，服務人員的對講機說話真的很大聲，不知道是不是故意的。,10,台北君悅酒店,Booking.com
2023-10-18,大廳氣派，房間乾淨明亮，贊！,10,台北君悅酒店,Booking.com
2023-10-18,地理位置佳水龍頭壞掉、浴室水溫偏涼,10,台北君悅酒店,Booking.com
2023-10-18,"整體來說非常地不錯據了解飯店大多是15點後就可入住退房時間只需在12點前即可，這次我訂了君悅景觀房日(含俱樂部使用)，住宿安排在22樓整體感覺都很不錯,唯獨只有一點，為什麼我15點20分道確需在嘉賓軒傻坐到17點才可入住?這是為什麼?安排住宿的櫃台人員沒說明?是因為我訂房的價格有優惠還是連定兩天必須扣除兩小時入住時間?不懂?甚麼都好就是排宿人員非常有禮貌地把客戶當傻瓜感覺很不好?",10,台北君悅酒店,Booking.com
2023-10-18,"床1、狀況外的餐廳經理
我只是想把女兒沒吃完的早餐包起來回房間繼續餵，搞錯了我意思，以為我們要外包一人分的早餐帶走
2、聽不懂需求的櫃檯陳先生",10,台北君悅酒店,Booking.com
2023-10-03,交通便利，購物也相當方便。入住登記等待時間過久,10,台北君悅酒店,Booking.com
2023-10-03,地點、房型、硬體設施及早餐都很好。我訂雙人床房，一開始被安排到雙床房，跟客服反應第一時間還說是我訂錯，經確認後才換房間。,10,台北君悅酒店,Booking.com
2023-08-06,地點方便，在台北101旁，有天橋接駁微風南山和市政府捷運站。入住有24小時免費停車。預訂時指明是2成人2小童（有輸入兒童年齡），訂房系統建議雙床房，但check in 時前台才說雙床房的床其實不是大床，每張床睡兩個人會很擠⋯現實是真的不是兩張大床，有點失望。差不多9000台幣一晚，不包早餐，性價比只屬一般。建議家庭客要慎選。,10,台北君悅酒店,Booking.com
2023-08-06,地理位置很棒，飯店連通橋能通往101，對行人來說很方便安全，景觀房正對101，晚間能欣賞101燈光很美，早餐豐盛，是一次很棒的入住經驗,10,台北君悅酒店,Booking.com
2023-08-06,樣式多，口感適宜。,10,台北君悅酒店,Booking.com
2023-08-06,房間有點小價格有點貴，連照相都有點不忍心照出來分享給家人,10,台北君悅酒店,Booking.com
2023-08-06,"位置方便
早餐好吃床和枕頭太軟",10,台北君悅酒店,Booking.com
2023-07-02,景很不錯，方便,10,台北君悅酒店,Booking.com
2023-07-02,被升等成景觀房覺得很驚喜！房間尤其稱讚夜晚睡眠的安全性，足燈很亮但是不會影響睡眠，浴室的小夜燈亮度也很足夠，半夜上洗手間不用再找燈開開關關，影響同住家屬的睡眠，床也很舒適讓我一覺到天亮， 我真的很滿意！也很推薦帶長輩來住！,10,台北君悅酒店,Booking.com
2023-07-02,房間太小,10,台北君悅酒店,Booking.com
2023-07-02,辦理入住的櫃檯人員、房間凱菲屋的服務人員較顯急切,10,台北君悅酒店,Booking.com
2023-06-16,電視無法觀看 用了很多次怎麼點都是黑幕,10,台北君悅酒店,Booking.com
2023-06-16,早餐好吃！停車方便！,10,台北君悅酒店,Booking.com
2023-05-21,"地點不錯週末夜含嘉賓軒，三人一萬七，這都ok ，但房間沒有預期的大，嘉賓軒沒有預期的精緻與服務，更糟的是浴室洗手台的那個孔還是什麼的，還壞掉，無法排水，要用手一直拉著讓它排水，這應該不是我們入住才壞掉，之前清潔人員沒發現沒通報？
蓮蓬頭很重，水壓也不是很高，沒有沖起來舒爽的感覺。其實人生本就運氣，過了就算了，不打算計較但也不打算再入住。",10,台北君悅酒店,Booking.com
2023-05-05,房間香香的很舒適冰箱飲品跟零食要錢耶，而且還不便宜！,10,台北君悅酒店,Booking.com
2023-05-05,全部都超級好 還要再來！,10,台北君悅酒店,Booking.com
2023-05-05,好的位置 舒適的房間房間沒有免治馬桶,10,台北君悅酒店,Booking.com
2023-05-05,滿意,10,台北君悅酒店,Booking.com
2023-04-21,checkin時間拖慢，房間陳舊霉味重，清潔不確實,10,台北君悅酒店,Booking.com
2023-04-21,飯店內販賣點心的部份是十點才營業，當時是9：15對於我必須趕著離開又想買伴手禮相當不方便，雖然店內人員很客氣地拒絕了我，但心中的感受不佳~,10,台北君悅酒店,Booking.com
2023-04-21,早餐很豐富超棒的員工素質訓練有待加強,10,台北君悅酒店,Booking.com
2023-04-21,早餐很好，地理位置也好。,10,台北君悅酒店,Booking.com
2023-04-06,房間設備感覺大概四星飯店等級，根本沒有五星級酒店級數，早餐別相信網路打手，如果評分標準十分，大概只有兩分，性價比極差。,10,台北君悅酒店,Booking.com
2023-04-06,逛街非常方便，大年初一有放鞭炮、舞獅、鼓樂表演，讓即使在飯店過年的遊客，也能感受濃厚的年味,10,台北君悅酒店,Booking.com
2023-04-06,总体来说一点都不像一家五星级酒店。checkin是就被告知床单roomkeeping都是两天一次，理由说是为了环保，实际上难道不是节约成本吗？并且还未入住就被很仔细地问了退房时间，询问原因说是为了合理安排接下来的入住，像赶着客人早点走一样。要加一床被子，都被告知满房不一定有。这么多年到处飞，这种品质连商务酒店都不如。希望好好整顿一下。别再金玉其外败絮其中了。性价比低到惊人。,10,台北君悅酒店,Booking.com
2023-04-06,服務態度與應對很有品質,10,台北君悅酒店,Booking.com
2023-03-20,房務阿姨非常有禮貌櫃檯接待人員不專業,10,台北君悅酒店,Booking.com
2023-03-20,位置服務熱情程度和細節,10,台北君悅酒店,Booking.com
2023-03-20,服務人員專業度，非常的優秀！衛浴設備,10,台北君悅酒店,Booking.com
2023-03-07,員工態度良好、親切暫時沒有,10,台北君悅酒店,Booking.com
2023-03-07,櫃檯人員很專業又熱情，也幫我們解決了問題，很謝謝她❤️,10,台北君悅酒店,Booking.com
2023-03-07,"沒什麼特別的地方1. 停車場一堆漏水痕跡，完全不像五星級飯店，車道標示不清
2. 一萬塊的價位，連個迎賓水果也沒有，冰箱也沒放個付費飲料。
3. 電視HDMI無法切換 整個問號
4. 房間內也沒放個衛生紙，還要跑到廁所拿
5. 五星級飯店沒有免治馬桶座",10,台北君悅酒店,Booking.com
2023-03-07,地點很棒。麵包坊的麵包很好吃,10,台北君悅酒店,Booking.com
2023-02-27,一般員工和靄可親check in 櫃台小姐 非常不好 態度不行。,10,台北君悅酒店,Booking.com
2023-02-27,早餐豐富沒有免治馬桶，恆溫馬桶蓋,10,台北君悅酒店,Booking.com
2023-02-27,服務人員無論是櫃台、餐廳、桑拿、泳池，都非常親切服務很好。寢具也很乾淨舒適，早餐豐盛。訂房時有註明是兩大+兩小（14歲、12歲），房間卻只能提供兩張單人床+一張沙發床，若能有兩張雙人床就更好了。,10,台北君悅酒店,Booking.com
2023-02-20,交通方便沒有每日換床單,10,台北君悅酒店,Booking.com
2023-02-11,住宿3夜二萬五千多元早餐另外付費，我不知道沒有含早餐,10,台北君悅酒店,Booking.com
2023-02-11,地點方便沒有,10,台北君悅酒店,Booking.com
2023-02-11,自助餐太多人了,10,台北君悅酒店,Booking.com
2023-02-11,在世貿旁，非常方便！,10,台北君悅酒店,Booking.com
2023-02-01,客房服務貼心無,10,台北君悅酒店,Booking.com
2023-02-01,客房服務貼心週到，餐點美味迎賓水果壞了沒檢查到,10,台北君悅酒店,Booking.com
2023-01-29,沒有免治馬桶,10,台北君悅酒店,Booking.com
2023-01-29,房間舒適，設備看的出來有歷史但有在維護早餐人多建議分流，餐點普通,10,台北君悅酒店,Booking.com
2023-01-29,離101捷運很近,10,台北君悅酒店,Booking.com
2023-01-27,接待人員很親切，中英文都很好，而且會觀察細節，提供客戶驚喜的貼心服務。沒有免治馬桶，車用充電樁只有一支實在太少,10,台北君悅酒店,Booking.com
2023-01-24,安靜忘了放香皂,10,台北君悅酒店,Booking.com
2023-01-24,服務人員用心親切，早餐豐盛，電梯多台快速，房型舒適！停車場稍嫌老舊位置擠,10,台北君悅酒店,Booking.com
2023-01-24,"早餐豐盛用心、食材新鮮 水準之上
酒店位置佳插頭位置不佳
房內無提供面紙
櫃檯服務臨櫃的接待溫度待改善",10,台北君悅酒店,Booking.com
