review_date,review_text,review_rate,review_hotel,review_source
2023-09-30,我因為工作在這裡住了 4 個晚上。 首先，到達後行李員很熱情，前台工作人員也微笑著講日語。他們先核對了收據上的地址，感覺他們已經習慣了日本人出差，所以心裡很踏實。 房間很乾淨，大小也很合適，桌子也很方便使用，所以我可以毫無壓力地度過我的時間。 房間裡的電器都有日文說明，很容易理解。 我沒有吃早餐，因為我想吃當地的食物，但我希望我至少要過一次。 位置在市中心，所以可以步行去很多地方，出租車很便宜，而且地鐵就在附近，所以我完全沒有任何問題。當我問工作人員我想搭計程車去哪裡時，他們立即記下筆記，安排了計程車，並告訴司機我要去哪裡，這非常有幫助。 一樓的甜點，我們吃了鳳梨酥和起司蛋糕。它的重量和甜味很豐富，是最好的。下次我想嚐嚐麵包。 當我去台北時，我想再次使用這家酒店。 （添加） 上次我在一月份住在那裡，這次我在九月因為工作在這裡住了 3 個晚上。 和上次一樣，Bell、前台和其他人都有很好的微笑、問候和服務，讓我對經理的管理政策感到放心。員工的想法始終從顧客的角度出發，對細節的關注使我們有別於歐美各大連鎖飯店。 *這裡的蛋糕、麵包、烤餅等都非常好吃。,5,老爺大酒店,Google
2023-09-27,我最近住在這家酒店並有不同的經歷。整體住宿體驗非常愉快，有幾個突出的特點。 從我辦理入住的那一刻起，專業的工作人員就給我留下了積極的印象。他們彬彬有禮、高效，確保我順利、溫馨地抵達。 客房外送服務是我住宿期間的一大亮點。食物很美味，而且及時送到我的房間，讓用餐變得方便和愉快。 床非常舒適，可讓您在經過一整天的旅行和活動後睡個好覺。 然而，有幾個領域需要改進。首先，飯店走廊顯得過時。煥然一新的外觀會增強整體氛圍。 此外，我在泳池的經歷因遇到泳池工作人員而受到輕微影響，他們要求查看我的門禁卡。雖然我理解安全的必要性，但他們的做法顯得有些唐突。但我必須說，泳池工作人員熱情友善。,5,老爺大酒店,Google
2023-09-27,老爺酒店入住多次，前台及門僮服務良好，房間大設備足。 自助早餐選擇多，美味可口。 這次第一次在明宮午餐及晚餐，午餐蝦餃燒賣非常美味，晚餐時燒味及小菜也好吃。 下次來台也會選擇入住。,4,老爺大酒店,Google
2023-09-26,於9/24-9/25入住台北勞爺大酒店一個晚上 辦理入住手續時因為時間還早所以單純辦理入住先寄放行李 櫃台人員非常親切處理速度也很快速 也麻煩櫃台幫我叫計程車也是很迅速 等到三點多回來可以直接拿房卡進房且行李已送房 打電話至櫃台要借用轉接頭也是立即送到房間 房間雖然偏小但是有浴缸該有的也都有 至於早餐想對於其他五星酒店選擇確實比較少一點 會有一種在思考到底要吃什麽的感覺 較普通 然後再退房前發生了一些小擦曲 但不影響我還是願意給老爺大酒店五星好評,5,老爺大酒店,Google
2023-10-01,讚,5,台北晶華酒店,Google
2023-10-01,我最囍愛Regent，一流的酒店，一流的服務 :) 我還囍愛每天晚上18：00～21：00中庭餐廳飄揚的鋼琴演唱，以及穿插一首生日快樂歌：Happy Birthday to you .. 祝你生日快樂 .. 還有聖誕節火紅雄偉巨大的聖誕樹，你每年都可以坐在聖誕樹前為你準備好的椅子上照相留念。 日常或特別的日子：聖誕、生日、年夜飯 .. 都可以有你，享受美麗幸福的人生！,5,台北晶華酒店,Google
2023-09-30,入住行政套房，很舒服👍,5,台北晶華酒店,Google
2023-09-30,台北晶華酒店的團隊是認真的，房間裡給的空間很足夠（至少我住的房型是如此），建築有了年紀，但是維持與整潔度是好的。浴室採用乾濕分離，浴缸外沒有排水孔，浴室地板用的是大理石石材，因此無論是淋浴出來或是泡澡離開澡缸都有滑倒顧慮。 床超級無敵難睡，讓我半夜發坐骨神經痛，當我痛到不能入睡，想看電視轉移楚痛，才發現電視機是壞掉的。 在床的問題上，晶華酒店違背了住宿的基本功能，讓旅人有好眠才是晶華酒店該做的事。我會因此而將晶華酒店從我旅行落腳名單中剔除。晶英酒店在這方面比晶華酒店強太多了。 這次會住晶華酒店主要原因是為了吃晶華有名的牛肉麵，使用了房間服務，牛肉麵送進來後吃起來的滋味如同現煮，美味極了，所以我給晶華酒店四顆星。 早餐表現的中規中矩，仍是柏麗廳的水準。,4,台北晶華酒店,Google
2023-09-30,入住15樓雙人房，桌上出現小隻的蟑螂，房務人員上來還說酒店老舊無法避免，以五星級飯店及價位來看非常不及格 值班副理協助換房，結果19樓的床頭燈及書桌燈跳電，又請房務來協助排除 整體的感覺非常不好,3,台北晶華酒店,Google
2023-09-29,它的咖啡廳永遠都是很火的地方。,5,台北晶華酒店,Google
2023-09-29,房間乾淨 鑰匙使用實體鑰匙 小不方便 整體感受還不錯 不過電梯沒辦法直接到B1 這點真的很讓人困擾,5,台北晶華酒店,Google
2023-09-29,工作人員總體上都很友好。 大廳工作人員對客人安全的優先考慮給我留下了特別深刻的印象。早餐也很美味。,5,台北晶華酒店,Google
2023-09-29,很棒的酒店，有很多豪華精品店和很棒的餐廳。週末度假的好地方。室外泳池，題材短，晚上看還是不錯的。,5,台北晶華酒店,Google
2023-09-28,床好睡，早餐好吃，洗髮精很讚！,5,台北晶華酒店,Google
2023-09-28,我是去開會、吃飯，沒有住宿過；服務態度沒話說的好～地點也很棒,5,台北晶華酒店,Google
2023-09-28,還可以， 但是清掃不乾淨…🤮,3,台北晶華酒店,Google
2023-09-27,栢麗廳的buffet 食物品項比較偏何異國料理 ，如果喜歡葉國料理的朋友們 應該不會讓你失望的餐廳,4,台北晶華酒店,Google
2023-09-27,景觀很好👍🏻離附近的百貨區也不遠，很方便🥰,5,台北晶華酒店,Google
2023-09-27,服務好 環境挺不錯哈哈哈,5,台北晶華酒店,Google
2023-09-27,自從上次離開晶華後，已過了一年。 前幾次住宿體驗不算太美滿，這次碰巧遇到點數房23800的優惠，臨時起意來住一晚，且看能不能對晶華改觀。 /Check-in/ 前幾次不佳的住宿體驗，讓前台人員應對時如履薄冰。之前的經驗，簡單來說就是床墊沒鋪好有大縫隙，或半夜全館沒電沒燈沒空調然後沒補償的鳥事。 這次IHG會員有專屬櫃檯可以辦理入住，雖然該櫃檯人忙到不見蹤影。最後還是要回去原本的櫃檯排隊。 /房型/ 感謝晶華幫我的點房升等為高樓層的公園城景房，可以看到101，夜色也很美。 晶華在台北高級飯店的市場裡，有一個很大的優勢，那就是基本房都超過十三坪。 大家若住過喜來登或君悅的基本房，應該都可以感受到室內空間的侷促。 這種委屈感在晶華不曾有過，晶華的基本房可以在室內奔馳不會撞到桌腳。 有了上次睡不好的慘痛經驗，這次床總算鋪好了，一夜好眠。 唯一缺點是淋浴間不斷飄出化糞池或消毒水的臭味，我們選擇遠離那個浴室去三溫暖洗澡，只能說我跟晶華或老飯店的磁場大概不對盤。 /餐食/ <早餐> 晶華早餐似乎很受歡迎，一早發出限動之後，有許多朋朋傳訊來說很喜歡他們的早餐。 可見晶華確實在早餐這一塊穩坐江山了。 <酒廊午茶> 持有IHG酒廊Pass的朋朋，下午三點就可以來到雲天廊享受飲料與乾果，現在的雲天廊只有日本人，人數也不多，算是清幽。 雲天廊看起來是兩間房間合併改裝出來的空間，裡面不大，但免費仔能受此招待，已感到相當滿意。 <雲天廊Happy Hour> 雲天廊HH大有進步！沒想到一年前平日沒有熱菜的雲天廊，已進化成餐食有誠意的酒廊。 餐點豐富度、美味度皆勝過同級的君悅。 但，冰淇淋還是一樣難挖喔，像石中取劍般難如登天。 /飯店設施/ <健身房、泳池、三溫暖> 這裡的健身房大又齊全，還有飛輪教室。 頂樓泳池甚至有露天電影院，也是晶華體系的招牌與驕傲。 而三溫暖雖然在地下室，但設施齊全休息室舒適，儘管是一間有年紀的飯店，設施保養皆不含糊。 /心得/ 只要點房成本能訂到一晚低於4000台幣，並持有IHG酒廊Pass，我都覺得不需任何理由就可以訂來住。住宿會有水果迎賓禮、上庭飲料券(綜合果汁極好喝)，週年紀念日還送四吋蛋糕，點房一律含早，很有誠意。 若否，則用美運卡訂現金房3300含早來住也可以。 不然，畢竟是老飯店了，雖然服務貼心週到，但硬體畢竟不能跟新飯店比。若價格太虛浮的時候要考慮一下。,4,台北晶華酒店,Google
2023-10-01,房內設施頗新，還有平板可以查詢景點與服務，飯店門口服務員親切有禮，鄰近也有全家、7-11或早餐店，白天晚上覓食都方便，走一小段路也有捷運站，交通方便。,5,亞都麗緻大飯店,Google
2023-09-26,我根據推薦進行了預訂。可能是因為我被安排在12樓頂樓的緣故，但是房間很乾淨，設施也很完善。淋浴很熱，沒有什麼好抱怨的。 他們接受了我點的早餐，我沒有太多時間，所以我吃了普通的自助餐，但很美味。我想在下次出差時再次住在這裡。 （早餐工作人員很友好而且很好。）,5,亞都麗緻大飯店,Google
2023-10-02,打開車門就看到kevin以陽光的笑容迎接我並且非常親切地幫我搬行李 進入大廳以後看見熱情的Linus指引我到櫃台做check in,5,台北福華大飯店,Google
2023-10-02,謝謝kevin 在中秋繁忙的日子熱心的幫我欄計程車 車子真的很難叫,5,台北福華大飯店,Google
2023-10-01,地下停車場居然沒電梯，要扛著行李走樓梯上去 床硬睡得不是很舒服，隔音不太好 珍珠廳住客可打折但吃得不是很滿意,3,台北福華大飯店,Google
2023-10-01,彼得和本，服務很好！,5,台北福華大飯店,Google
2023-09-30,台北福華大飯店屬於老字號的五星級飯店，交通便利、服務親切到位，有令人賓至如歸的感覺。,5,台北福華大飯店,Google
2023-09-29,John Huang,5,台北福華大飯店,Google
2023-09-29,我大約下午5點半入住。幾分鐘前工作人員確實告訴我這裡正在施工，但不是在我的樓層。然而，我可以清楚地聽到我房間裡的施工聲。 四個小時後的晚上9點30分，當我和朋友聚餐回來時，我仍然可以聽到錘子和電鑽的聲音。最讓我煩惱的是，我打了兩次電話，一次是下午5:30左右，一次是晚上9:30左右。而且，工作人員一直說所有工人都走了，或者說我們仍在檢查。哦！他們不知道大樓正在施工嗎？ 順便說一下，我確實用手機記錄了錘子和電鑽的情況。 隔天早上我退房的時候，一位經理確實拿著一小盒蛋糕來道歉，我沒有接受。我的問題是為什麼像霍華德這樣的歷史悠久的酒店不知道建築內部的建設。而且，他們甚至沒有算出從下午5點30分到晚上9點30分這四小時的時間。意思是，如果我不打電話，工人們將繼續鑽孔和錘擊...... 我不認為這是我應該待的地方。不是因為房間裡的噪音，而是因為辦公室裡的飯店管理人員。,1,台北福華大飯店,Google
2023-09-29,還不錯,4,台北福華大飯店,Google
2023-09-27,前台ANITA很親切，即使在下午忙碌的入住時間，你也能看到她眼裡的微笑。,5,台北福華大飯店,Google
2023-09-27,在此飯店的點心坊買的蛋糕竟然不能在飯店的咖啡裡吃，所以在此飯店買了蛋糕只能站在馬路外面吃！ 也不是沒有在咖啡廳裡點飲料，每個人都點了一杯飲料！ 真的是荒謬至極的飯店🙄,1,台北福華大飯店,Google
2023-09-27,這是我五年來第一次入住🎉🎉 當我還是上班族的時候，我出差的時候每個月都會來這裡住一次，但是自從新冠疫情開始，我已經四年沒有來過這裡了！（哭） 入住時的溫馨感覺是最好的。 AnitaLiao熱情的歡迎我的話語讓我更熱愛台灣。 我真的很高興來到台灣。,5,台北福華大飯店,Google
2023-09-27,餐廳結帳人員莊惠茹很細心且有耐心的解釋禮券使用規範，服務很好👍,5,台北福華大飯店,Google
2023-09-27,不錯的位置，美味的食物。非常友好和微笑的工作人員。感謝您的愉快住宿。受到推崇的,5,台北福華大飯店,Google
2023-09-27,緊鄰捷運站、豐盛好吃的中餐便當,4,台北W飯店,Google
2023-09-27,你說你記得我喜歡聽什麼歌 但我在他身上搖的時候也是放這一首,5,台北W飯店,Google
2023-09-26,我真的很喜歡自助早餐。一切都很好。,5,台北W飯店,Google
2023-10-02,好的,5,台北君悅酒店,Google
2023-10-01,房間條件很好，工作人員很友好，早餐很好。,5,台北君悅酒店,Google
2023-10-01,致電確認AE卡方案問題，前台轉去客服組，一位大陸口音很重的窗口一直鬼打牆的回答不出答案，又把我轉去前台，爛透了這服務，可以專業點嗎🤦🏻‍♂️,1,台北君悅酒店,Google
2023-09-30,感覺有些基層年輕工作人員疲憊有火氣，一樓早餐用餐、連出停車場繳費處都被莫名波及。二樓義大利餐廳服務很不錯👍,4,台北君悅酒店,Google
2023-09-29,二樓素食精緻好吃，甜點也美味。,4,台北君悅酒店,Google
2023-09-29,兒童餐具有髒污,3,台北君悅酒店,Google
2023-09-29,還不錯 風景很好👍,5,台北君悅酒店,Google
2023-09-29,這家飯店很棒，他們的水療中心也可以免費使用（獎勵住宿）。就在台北101對面。服務也很棒，位置也很方便。,5,台北君悅酒店,Google
2023-09-28,飯店服務人員非常親切，上次入住時有一件衣服忘在房間裡，飯店很nice的幫我收好，真的非常感謝😍❤️👍,5,台北君悅酒店,Google
2023-09-28,101旁邊，原先對這家老五星，不報太大期待，沒想到房間乾淨新穎毫無霉味，床好睡，17樓視野超好，房裡字畫優雅，地下停車場不像老飯店狹隘，早餐餐廳很大，餐點雖有點小失望，但服務人員勤快，很多英文對話，應該外籍旅客多吧。,5,台北君悅酒店,Google
2023-09-27,所有餐廳的餐點 大部份都不錯 大廳的烘培坊 麵包跟蛋糕也很美味 加入會員折扣多 無會員消費並不是很划算 服務親切 環境優美 景觀視野佳 裝潢氣派豪華 停車場寬敞車位多,5,台北君悅酒店,Google
2023-09-27,工作人員不斷地毫無理由地進入房間。沙發被弄髒了。,1,台北君悅酒店,Google
2023-10-01,坐捷運方便，開車也方便，有自己的停車場，今天是去2樓的港式飲茶，鹹水餃，叉燒，烤鴨，蛋塔都好好吃,5,兄弟大飯店,Google
2023-10-01,午餐時間家人朋友聚餐,3,兄弟大飯店,Google
2023-09-30,老牌的大飯店，餐點口碑值得推薦,5,兄弟大飯店,Google
2023-09-30,交通很方便，東西好吃,5,兄弟大飯店,Google
2023-09-30,飲茶好吃,4,兄弟大飯店,Google
2023-09-29,我在1F用餐服務很棒餐點也好吃…,5,兄弟大飯店,Google
,好吃的辰園餐廳 港點真是一流,5,台北寒舍喜來登大飯店,Google
2023-10-01,飯店部分中規中矩，清潔度、設施、備品無一可值一提之處，床還算舒服，早餐蠻讓人失望，沙拉以美生菜為主，連蘿蔓都沒有，湯品全是溫的不熱，用料也不太好，大多菜式煮得很粗，麵包也都很普，讓人懷念起上個月在日本連鎖平價飯店的現烤麵包早餐，果汁是原汁含量少的加糖飲料，整體來說毫無亮點，比起其他台灣4-5星級飯店也是不如。,3,台北寒舍喜來登大飯店,Google
2023-10-01,停車等超久，以一個五星飯店來說太糟糕了👎🏼👎🏼👎🏼,1,台北寒舍喜來登大飯店,Google
2023-10-01,雖然不是新飯店，但設施條件不錯。 他們還補充了4瓶水，足夠了。 有時網路會停止工作，但我打電話給前台，他們很快就回覆了，所以這不是問題。 如果您打開打擾燈，房間將不會被打掃，因此，如果您要外出幾個小時，最好要求他們將其取下並打掃乾淨。 說到貪心，我覺得這種檔次的飯店如果有獨立的浴缸和衛浴就好了。,4,台北寒舍喜來登大飯店,Google
2023-10-01,喜來登十二廚Buffet退步了,4,台北寒舍喜來登大飯店,Google
2023-09-30,早餐還頗豐富的呢，晚餐比較普通一點 居住環境也挺好 交通上很方便 整體來說，是可以再來一次的,4,台北寒舍喜來登大飯店,Google
2023-09-30,好的,5,台北寒舍喜來登大飯店,Google
2023-09-28,雖然是高級飯店，但還是能聽到許多外界的噪音。,5,台北寒舍喜來登大飯店,Google
2023-09-28,2023 年 9 月：地理位置優越。地鐵站 2 號出口就在前面，如果您想使用電梯搬運行李，請使用 3 號出口。,5,台北寒舍喜來登大飯店,Google
2023-09-28,東西好吃，但是好像人手不太夠。,5,台北寒舍喜來登大飯店,Google
2023-09-27,這篇評論是針對有品嚐菜單的賓館的。服裝要求從休閒到正式。我們選擇了松木套裝。整體來說還是不錯的。他們給你的份量比大多數品嚐菜單都多。我希望聽到服務員對每道菜進行解釋，而不是僅僅把它寫下來。我們沒有做米其林菜單，但我們的菜單上也有許多相同的項目。 對我來說最精彩的是第一道菜，盤子裡有6種不同的菜品，佛跳牆雞湯、紅燒肘和蛋白燕窩杏仁湯。 龍蝦辮子有點乾，加點奶油會改善味道。煎A5和牛很好吃，但在我嘴裡沒有融化。很快的魚肉汁炒蛋很好吃，但我希望能有更複雜的東西。這是您可以在常規菜單上而不是品嚐菜單上找到的菜餚。這應該被更高檔的東西取代。我會給品嚐菜單3.5/5分。,3,台北寒舍喜來登大飯店,Google
2023-09-27,房間寬敞，浴室豪華，床鋪舒適。廁所配有衛洗麗。前台有會說日語的工作人員。此外，電話分機僅支援日文撥號。冰箱壞了，但當我聯繫他們時，他們立即更換了。如果你通過分機要冰塊，他們會立即送來。接待處的工作人員也很熱情，即使只會說日語也可以度過輕鬆的時光。早餐是自助式的，可以選擇台灣菜，而且都很美味。就在善堂寺站旁。距離台北車站步行約10分鐘。善堂寺站之間有超市和便利商店，非常方便。無需搭乘地鐵，步行10分鐘即可抵達國立中正紀念堂、228和平紀念公園、中華民國總督府。,5,台北寒舍喜來登大飯店,Google
2023-09-27,台北市的五星級酒店,5,台北寒舍喜來登大飯店,Google
2023-09-26,乾淨、舒適、交通方便、服務很好,5,台北寒舍喜來登大飯店,Google
2023-09-26,有停車空間很方便,5,台北寒舍喜來登大飯店,Google
2023-09-26,來參加smat活動餐會，餐點不錯,5,台北寒舍喜來登大飯店,Google
2023-10-01,距離主站最近 如果您在預訂時要求更新房間，我們將為您預訂一間更乾淨的房間。 因為是老建築，所以有些東西稍有欠缺。 我已經 5 天沒有看到任何蟲子或污染了。 一樓的咖啡廳好像用的是星巴克。 主站景觀（北面）有一點道路噪音。 房間之間的隔音不是很好。,5,台北凱撒大飯店,Google
2023-10-01,沒有游泳池。按摩必須預約。旁邊有一家很大的按摩店，還不錯，跟地鐵相連。一切都很接近。房間狀況：完全沒有異味，充滿香味，舒適。,5,台北凱撒大飯店,Google
2023-10-01,非常不推薦，房價貴品質不好。房間有煙味，一點都不像四星級飯店，令人失望,1,台北凱撒大飯店,Google
2023-09-30,就是一間交通方便的飯店而已,3,台北凱撒大飯店,Google
2023-09-30,作為一家五星級飯店，房間看起來是 3. 5 星級的規模。雖然房間很寬敞，但房間裡擺滿了舊家具和舊電視，有些頻道的接收效果不好。浴室確實進行了一些裝修。最好的是它的位置，因為它與地下商場相連。便利設施都在附近。,3,台北凱撒大飯店,Google
2023-09-28,可惜的是窗外景是隔壁樓景居多，其他的都很不錯：房間大小，交通便利，食店林立,4,台北凱撒大飯店,Google
2023-09-28,壁紙、床鋪、Wi-Fi等都更新了，有起碼的清潔感，但建築比較老舊，水暖空調設備遠不如日本連鎖商務酒店。 唯一的優點就是離台北車站近。除非重建，否則不會成為標準的客棧。,3,台北凱撒大飯店,Google
2023-09-28,東西掉了沒找到，服務品質待改善,4,台北凱撒大飯店,Google
2023-09-27,搭乘地鐵去觀光真是太棒了！屋頂花園裡有一個用來放香菸的煙灰缸。,5,台北凱撒大飯店,Google
,螃蟹長期以來一直不佳，生魚片筋膜太多了，真的很可惜,3,台北美福大飯店,Google
2023-10-02,台北市內五星級的大飯店，從地下停車場開始，整體空間設計現代化又高雅，各式餐廳各有特色，餐點更是評價高，是工商、家庭、朋友聚餐的好地方。,5,台北美福大飯店,Google
2023-10-02,非常好。桑拿很棒，游泳池也很棒！,5,台北美福大飯店,Google
2023-10-01,服務人員很親切。,5,台北美福大飯店,Google
2023-09-28,住宿環境感覺，附件蠻多可以逛的觀光景點,5,台北美福大飯店,Google
2023-09-27,跟妹妹與外甥女一起入住，準備在妹妹二寶卸貨前來個姐妹放鬆之旅，殊不知帶著三歲不到的孩子還是無法放鬆啊⋯⋯ 房間很滿意，空間大又乾淨，房間拖鞋很舒服，床也算好睡，可惜忙著顧小孩沒能去體驗飯店設施。 早餐表現中等，沒有雷的也沒太多記憶點，飲料類似乎跟午晚餐都相同，較無新意。 最不喜歡的點是下午四點才能進房、早上十一點卻要退房，時間真的有夠短，建議調整一下能讓旅客更能享受愜意的旅宿。,5,台北美福大飯店,Google
2023-09-26,甜點很不錯,5,台北美福大飯店,Google
2023-09-26,行政客房很棒 住的很舒適,5,台北美福大飯店,Google
2023-10-01,Buffet 還是不錯的cp值，常常換主題，價格也沒調整的很誇張，主要有折扣可以月月去吃👍,5,台北遠東香格里拉,Google
2023-10-01,如果你去這家店的酒吧喝酒，很顯然你只喝了兩杯卻喝醉，你不能在大廳休息，不然店員會叫警察強迫你馬上叫計程車回家，甚至未經你同意查看拿證件,1,台北遠東香格里拉,Google
2023-10-01,這段時間每位接待的服務人員都超級好，非常值得推薦台北遠企香格里拉，但不懂主管為何不讓房客續住？但我想每個中階主管一定有他的困難與限制，我體諒與包容，因為好的品質值得等待及給付高價的費用，我的確也可以去別的地方住，但若要住，我仍然會希望住在一個有品質的五星飯店，希望高層可以多多體諒底層員工的辛苦，給予他們應有的休息與報酬，然後協助旅客處理所有需要協助的部分。 以上 祝所有香格里拉員工一切安好適得其所才華被看見得到應有的回報,5,台北遠東香格里拉,Google
2023-10-01,對於五星飯店但是服務不周到 覺得有點失望,2,台北遠東香格里拉,Google
2023-09-27,我覺得很棒的飯店,5,台北遠東香格里拉,Google
2023-09-27,李秋草服務親切！餐廳用餐愉快！東西食材有不同以往的特色,5,台北遠東香格里拉,Google
2023-09-26,"對於五星級的價格感到失望。登記處的那位女士兩次離開去幫助其他人。 房間裡沒有隔音，所以我聽到右邊房間的半夜電話談話和左邊房間的電視。 （都聽得很清楚。）🎶 早餐有很多選擇，但沒有一件事做得很好☕️🥚 在Shang吃了一頓飯，人均台幣3,500元，完全沒有留下深刻的印象🤷在台北花更少的錢就能吃到很多美味的飯菜。 透過飯店訂了一輛車去機場，司機沒有給我時間在開車前繫上安全帶💨 這是飯店所缺乏的典型的修飾類型。 ➕ 床非常舒適，每天都會為房間添加新鮮水果。景色很好。 🌆 🚊 離地鐵站不近也不遠。可接受的位置。",2,台北遠東香格里拉,Google
2023-09-30,帶爸爸参加了同學會。房間乾淨舒適。臨走還幫我們叫車。服務非常好。,5,三德大飯店,Google
2023-09-29,離台北車站沒有很遠! 交通 方便!,5,三德大飯店,Google
