review_date,review_text,amenities_score,service_score,location_score,overall_rate,review_hotel,review_source
2023-10-31,在北投鐳加賀屋以真正的日式風格慶祝生日。從我踏入的那一刻起，這就是令人難忘的。 管家帶我們到我們的房間，房間裡可以看到北投的美麗景色，服務很暖心，詳細的解釋了酒店的情況。生日套房套餐是一個令人愉快的驚喜，包括一個 4 英寸的蛋糕、貼心的禮物和裝飾精美的生日房間。對於工作日住宿，他們甚至像我們一樣免費升級房間！ 入住期間，您將被自己的私人溫泉浴場的魅力和一系列有趣的活動所吸引。你甚至可以租用漂亮的浴衣，穿上漂亮的浴衣去探索小鎮~ 真正讓這次住宿與眾不同的是有機會捕捉美好的回憶。從裝飾生日的套房到美味的懷石料理，再到優雅的 Sunset Moon 酒吧小酌一杯，這真正重新定義了慶祝活動。,,,,5,北投日勝生加賀屋國際溫泉飯店,Google
2023-10-31,服務非常好，進來就像到了日本一樣，每季節的活動設計很用心，一樓夏季品項很多也很日本，施舒雅芳療很舒適又安靜，樓上餐廳也非常精緻,5.0,5.0,5.0,5,北投日勝生加賀屋國際溫泉飯店,Google
2023-11-04,泡湯區環境不錯，還有自助吧可以吃，讚👍,,5.0,5.0,5,南豐天玥泉會館,Google
2023-11-03,如果兩個女仔沖涼太唔方便 櫃檯人員服務不佳,4.0,2.0,4.0,1,南豐天玥泉會館,Google
2023-11-03,下午雖然茶甜點不多 但是吃的很開心,5.0,5.0,5.0,5,南豐天玥泉會館,Google
2023-11-02,今天跟家人來泡大眾池，環境很乾淨，泡的很舒服，出來還可以享用美食茶和咖啡、果汁。,5.0,5.0,5.0,5,南豐天玥泉會館,Google
2023-11-01,服務人員親切～需要冰塊也馬上提供，環境乾淨舒適，早餐好吃😋很值得再來,5.0,5.0,5.0,5,南豐天玥泉會館,Google
2023-11-06,這是我第一次去住天籟渡假酒店，因為我們從台北市開過去，路透比較遠，從金山過去會近很多。整體體驗非常棒，食物多樣也很好吃，還可以手作棉花糖，餐廳對於幼兒非常友善且有耐心！房間很大，比起重新裝潢後變小了的五星酒店，我個人比較偏好這種類型的，雙人大床的房間，真的很舒服。晚上還可以在房間泡湯享受，抬頭就可以看星星，非常浪漫放鬆！整體房間裝潢很典雅，雖然是老牌飯店，但是我真心覺得維護的很好！乾淨整潔，房間又大！ 露天風呂與泳池方面：本身很喜歡泡湯，對於有很多池子可以泡我很喜歡，可以一直泡看看不同溫度的溫泉。因為風景優美，然後佔地很大，又規劃的很舒適，只可惜沒泡到裸湯，下次再嘗試。整體我覺得非常放鬆，泳池的溜滑梯跟滑水道好玩到小朋友回房間秒睡，然後上面的類似無邊際泳池真的是我最喜歡的，水溫適中，深度剛好，然後剛好可以看藍天白雲跟壯麗的山景，趴在池邊真的是非常非常舒服又放鬆。 然後最感激的就是飯店的服務人員，我們帶孩子離開時因為匆忙，整個忘記收拾泳具就直接回家，到了半路才想起來，馬上致電飯店，感謝飯店的工作人員幫我打包寄回家裡，要不然這麼遠的路程也不是一兩天就可以再回去拿東西的。真的非常謝謝飯店的工作人員的大力幫忙！ 下次還要再帶爸媽跟孩子回訪～ 十顆星🌟🌟🌟🌟🌟🌟🌟🌟🌟🌟,5.0,5.0,5.0,5,陽明山天籟渡假酒店,Google
2023-11-03,晚餐自助火鍋$1000/人，菜肉品質非常差，住宿客人只能食用架上三款平價火鍋肉品，建議不要在這裡用餐。 現金付費客人可以享用單點肉品，被區別對待感覺很差。,2.0,1.0,1.0,1,陽明山天籟渡假酒店,Google
2023-11-02,住陽台有半露天湯池的四人房，感覺不錯。戶外的湯很多池、花樣很多，還有水世界區可以玩2個小時以上不無聊。唯一的問題就是錢要準備好。,5.0,5.0,5.0,5,陽明山天籟渡假酒店,Google
2023-11-02,偏遠山區，環境清優，房間有私人室外溫泉,4.0,5.0,3.0,5,陽明山天籟渡假酒店,Google
2023-10-31,給司領房很爛,,,,1,陽明山天籟渡假酒店,Google
2023-11-05,望接待人員對於”大眾池”定義可以不僅限於”裸湯”，官網介紹戶外風呂亦有溫泉池(需穿泳衣），對於只住一晚的住客不會徹底了解大眾池指的是戶外溫泉池還是裸湯，告知穿著泳衣了還被糾正泳池旁的溫泉池不是大眾池是游泳池、大眾池是裸湯，五星飯店對於設施定義很狹隘，未來住宿的客人記得要去戶外溫泉池(著泳裝）要說是游泳池不能說是大眾池，不然會被糾正大眾池指的是裸湯喔,5.0,2.0,4.0,4,北投麗禧溫泉酒店,Google
2023-11-05,112/11/4 週六下午在水岸茶屋吃下午茶待到最後五點前離開，走掉前聽到一位打掃的綁馬尾員工嘲弄我們這一桌「下巴是不是有洞」，食物殘渣掉到地上。既然綁馬尾員工提出這樣的疑問，那我們就在此回覆： 貴公司的下午茶很美味，國王派很酥卻也因此容易掉碎片下來。若不想用手直接抓來吃，以叉子接口本來就容易掉渣。如果因為這樣而被形容為「下巴有洞」，那麼我們順便在此評論向馬尾員工致歉： 不過我想反問馬尾員工，您知不知道形容人家「下巴有洞」是什麼情況？是嘲弄氣切的還是鼻咽癌的病友？如果貴寶號的員工因無法接受處理無心導致的食物殘渣，而必須要用這樣的形容來描述客人(還大聲到讓我們四人聽到)，非常建議貴寶號在美美的食物DM上特別註明：「國王派易落屑，食用請特別注意。」 不要讓來這邊放鬆的醫療業客人，帶回一種無法接受奇怪又難過心情。 謝謝。,3.0,1.0,3.0,2,北投麗禧溫泉酒店,Google
2023-11-04,美麗的景色，美麗又美味的午餐。,,,,4,北投麗禧溫泉酒店,Google
2023-11-03,#Elsie帶你遊｜🇹🇼｜北投麗禧溫泉酒店 Grand View Resort Beitou Hotel . . . ✨ 度假感十足 推薦北投溫屋 麗禧溫泉酒店 ✨ 終於隆重介紹到北投行程 我這次住了一晚北投溫泉酒店 非常之舒服。 這間溫泉酒店 位處山上 酒店提供Shuttle Bus接送服務 尚算方便 不過想要落山則記得預約 不然有機會會沒位車位乘坐。 每間房都環境清幽 房間望正北投文物館 能夠邊享受溫泉 邊望向日式庭園 真的是一大享受。房間溫泉池還有兩邊 是利用冷縮熱脹原理 幫助舒緩疲勞。溫泉有陣陣硫磺味 浸完以後 真係太放鬆 太舒服了。 房間設計是比較偏向日系 以木及石裝飾為主 充滿自然氣氛。 浴室的用品提供得非常之齊全 包括女士有卸妝水、爽膚水等等 在其他酒店是比較少見到有 另外酒店也很貼心 連男士的用品也準備齊全 包括鬚後水 等等👍 這個住宿體驗太愉快了 我很希望下次到北投的時候 也再次入住🥰,5.0,5.0,5.0,5,北投麗禧溫泉酒店,Google
2023-11-03,房間設計高雅，環境乾淨安靜，下午茶氣氛不錯也美味不會過甜，水岸茶屋服務很好值得推薦,5.0,5.0,5.0,5,北投麗禧溫泉酒店,Google
2023-10-31,優點： 1.必須給接待的服務人員一個大大的稱讚，由於是伴侶生日為了慶生入住所以有選擇生日布置的方案因此需要確認蛋糕送到房間的時間，在check in時接待人員怕戳破驚喜很機靈的私下詢問時間。 2.半露天式的溫泉非常舒服，在享受湯泉的同時還能感受微風吹拂、欣賞窗外的景色，陽台的貴妃椅提供了享受完湯泉後一個休憩的空間，設計非常人性。 缺點： 1.早餐精緻度不夠，能續點的菜色及提供的茶飲選擇太少。 2.餐廳的服務人員訓練不足。 3.晚上就寢時會不斷聽見野狗的吠叫聲，似乎是附近的野狗太多?,5.0,5.0,5.0,5,北投麗禧溫泉酒店,Google
2023-10-31,餐點好吃,,5.0,,5,北投麗禧溫泉酒店,Google
2023-10-31,這裡的溫泉體驗很棒 北投捷運站免費接駁車往返飯店 進入溫泉房贈送甜點 我們住的是私人房間，價格也算合理 每房2人NTD2500（每人加收NTD600，每房最多4人） 溫泉結束前15分鐘來電提醒,5.0,5.0,5.0,5,北投麗禧溫泉酒店,Google
