review_date,review_text,amenities_score,service_score,location_score,overall_rate,review_hotel,review_source
,晚上自助餐，牛肉料理都讚！,,4.0,4.0,4,老爺大酒店,Google
2023-11-06,整體來說飯店的入住體驗不錯，但櫃子看起來有點舊，覺得是時候重新裝潢了。,4.0,4.0,5.0,4,老爺大酒店,Google
2023-11-05,下午茶補餐速度不積極。3：45麵包沒了提醒服務生，但是沒人補餐。3：59再問一次，直接跟我說沒了。感覺做吃到飽的決心不夠，這樣也敢收一個人800？,,,,1,老爺大酒店,Google
2023-11-05,我是11/4新人請的攝影師， 場地很不錯，餐廳準備的便當真的是這幾年吃過最讚的， 我習慣拍攝結束後才用餐， 因為第一次造訪，不小心佔用了下午茶區的位子， 吧台的小姐還特別挪了好像是咖啡廳的位子給我用餐跟提供熱茶， 當攝影這麼久第一次遇到這麼禮遇的飯店， 可以在下工後舒適的用上一餐， 真的是很有人情味的飯店， 未來有到台北旅行活商務行程， 會優先考慮貴飯店入住。,5.0,5.0,5.0,5,老爺大酒店,Google
2023-11-04,櫃檯服務人員服務親切有禮貌 服務好,5.0,5.0,5.0,5,老爺大酒店,Google
2023-11-04,交通方便 附近有很多可以閒逛的地方。,5.0,5.0,5.0,5,老爺大酒店,Google
2023-11-02,有置於日本的幻覺！從進大門的門侍人員的熱情、到餐廳服務人員，日本料理的主管更是整場的靈魂人物！ 來到客房遇到整理房間的工作人員90度的彎腰問侯！ 讓人感到非常不可思議！ 在台灣的服務業裡算是值得推薦的飯店。,5.0,5.0,5.0,5,老爺大酒店,Google
2023-11-02,地理位置絕佳，適合觀光，自助早餐美味又豐盛，隔壁還有喜來登飯店，不過也同樣不錯。,4.0,4.0,4.0,4,老爺大酒店,Google
2023-10-31,位置離中山站很近，工作人員的熱情好客。,5.0,5.0,5.0,5,老爺大酒店,Google
,下午大約三點多的時候和家人去2樓的上庭酒廊用餐 走進去沒有接待就算了，被男服務員擋下還問我們在找什麼 並且一再強調該時段沒有餐點只能喝咖啡 說是要喝咖啡才讓我們入座 結果點完飲品隔壁桌來了一組客人 服務員上前就是介紹餐點和菜單 後來詢問才知道是要提前預訂 雖然本就沒有要吃東西 但感受不太好 點餐前詢問有沒有咖啡以外的飲品 送菜單的服務員 英文名字V開頭的小姐直接回應不知道叫我們自己看就走人 上飲品也沒告知是什麼品項 還要自己打開聞才知道是茶還是咖啡 用餐時有遇到一群像是參加完宴會的客人從樓上下來，吵雜的人群亂竄用餐區，甚至撞擊到我們的椅子，服務人員也沒有制止不要影響到其他客人，人群的動線非常奇怪，應該要多加宣導管理 第一次走訪 本想體驗晶華酒店下午茶的氛圍，這樣的價格跟服務不成正比，感受非常差，不會想再去,,1.0,,1,台北晶華酒店,Google
2023-11-06,超棒的酒店 (由 Google 提供翻譯) 超棒的飯店,5.0,5.0,5.0,5,台北晶華酒店,Google
2023-11-05,讚,5.0,5.0,5.0,5,台北晶華酒店,Google
2023-11-05,我不能推薦任何人入住這家飯店。 酒店設計過時，設計和保安不安全。飯店其他部分和大廳之間的地板不平坦，有墜落危險，因此飯店僱用工作人員站在間隙處提醒客人。房間是透過實體鑰匙進入的，而不是使用現在幾乎所有酒店都使用的現代掃描卡。隨後，隨機的人可以進入整個酒店。沒有安全或掃描系統阻止他們搭乘電梯進入客房。 我經歷了一場可怕的噩夢，一位鄰近的酒店客人，一位外國人，試圖闖入我的房間，甚至在附近的一位管家的幫助下，他走近並伸手拿鑰匙，幫助他錯誤地進入了我的房間。被抓後，清潔員和外國人二話不說就逃走了。 除了中階經理凱文之外，飯店管理層並沒有認真對待這次闖入企圖。高階管理層，特別是辛西婭·沉（Cynthia Shen）和西蒙·吳（Simon Wu），行為不負責任，並做出了極其可疑的回應，包括試圖撒謊和追查所發生的事情。我相信管理層將這個外國人的福祉置於當地人的利益之上，據我了解，他甚至沒有因為他的闖入嘗試而受到「懲罰」。 幾週後，我透過之前的預訂回來了。奇怪的是，辛西亞特意把我安排在事發時的隔壁房間。回到同一個地方是非常不愉快和痛苦的。如果那個外國人還在呢？台北晶華酒店是一家擁有無數房間的大型飯店，無需安排我返回相鄰的房間。更糟的是，儘管解釋了情況，前台卻說他們無權給我換房間。 台北晶華的管理階層對犯罪表現出漠不關心。他們選擇忽略明顯的事實，電子郵件一次會在近一個月的時間裡無法回覆。管理階層根本沒有興趣幫助或保護他們的客人，甚至是像我這樣的回頭客。再次強調，我不推薦任何人入住這家飯店。,3.0,1.0,5.0,1,台北晶華酒店,Google
2023-11-05,符合五星級的標準,4.0,4.0,5.0,4,台北晶華酒店,Google
2023-11-05,兒童遊戲室IRIS姊姊手作課程，小朋友愛不釋手，每位小孩乖乖聽老師上課，做出屬於自己最特別的手作風格,4.0,5.0,5.0,5,台北晶華酒店,Google
2023-11-05,柏麗廳的美食餐，很好吃，服務人員很友善，是很有水准的感覺，享受的鋼琴音樂的氛圍，唱歌很好聽，哈哈哈哈哈！開心！開心，完美的晚餐,5.0,5.0,5.0,5,台北晶華酒店,Google
2023-11-04,5F遊戲室手作課程非常棒！謝謝Iris姐姐陪同米米玩手作。,,,,5,台北晶華酒店,Google
2023-11-04,意外發現這個商務飯店的遊戲空間，感覺小而美，而且還有美美的教材教師Iris協助帶小朋友手做！👍這個服務真的超級友善親子❤️❤️❤️,5.0,5.0,5.0,5,台北晶華酒店,Google
2023-11-04,櫃檯服務人員服務親切有禮貌 服務好,5.0,5.0,5.0,5,台北晶華酒店,Google
2023-11-04,慶生順便住宿，晚餐吃柏麗廳（一泊2食）住宿劵，住房服務林先生特別提供蛋糕劵當晚就能兌換（其實需提前10天預訂，因為我們是第一次住特別給予，超感謝） 晚上6.天台泳池有提供電影，可以免費觀賞，氣氛超好，樓下餐廳有演奏，演奏員超棒，很會彈琴,5.0,5.0,5.0,5,台北晶華酒店,Google
2023-11-04,有能力處理大量且密集的人潮，管理一級棒,5.0,5.0,5.0,5,台北晶華酒店,Google
2023-11-04,下午茶還不錯👍☺,5.0,5.0,5.0,5,台北晶華酒店,Google
2023-11-03,萬聖節前的週末，在晶華酒店柏麗廳吃飯，訂的是晚餐，有好多萬聖節的裝飾，很有氣氛感。 食材部分、推薦無骨牛小排、紅蝦海膽握壽司🍣。 服務人員有認真打扮，營造節日感，期待明年萬聖節🎃再去玩。,5.0,5.0,5.0,5,台北晶華酒店,Google
2023-11-03,餐點不錯,,,,5,台北晶華酒店,Google
2023-11-03,地段好無可挑剔，附近商家林立、百貨公司美食街、台灣街邊小吃、知名餐廳應有盡有，最重要是能夠在高級酒店裡面開YSL的禮盲盒，人生已無所求哈哈哈,5.0,5.0,5.0,5,台北晶華酒店,Google
2023-11-02,我多次來訪，但對這次住宿感到非常失望。 熱情好客和服務精神不再存在於此......嘆息 有些船員甚至近乎粗魯。 曾經是一家很棒的飯店，這裡本身就是一個目的地。 如果你睡得很淺，請注意隔音不好，關門聲似乎是這裡的事情，而且酒店周圍有一些建築，而且他們很早就開始工作了！ 去過他們的姐妹酒店，絲綢宜蘭，服務同樣糟糕。 👎,5.0,1.0,4.0,3,台北晶華酒店,Google
2023-11-02,餐點美味，每道料理有功夫，服務人員態度佳。停車場算大，但還是容易滿場。,5.0,5.0,5.0,5,台北晶華酒店,Google
2023-11-01,連續兩年回台灣探親都住在晶華，這次竟然碰到外國人試圖闖入我們的房間！！事情發生在房務面前房務不但沒有阻止似乎還打算出手幫忙！在我開門後外國人迅速離去，房務也沒有打算道歉或是解釋，還要我出聲詢問，得到答案也是簡單一句外國人走錯房間。走錯房間？你怎麼知道他是走錯房間？在向值班經理反應後對方皮笑肉不笑的表示對方只是走錯房間，看來這間飯店人人有讀心術，不需要調查都能知道對方對行為動機。後續的處理也是一言難盡，總之不想擔心受怕建議另選住處,3.0,1.0,3.0,1,台北晶華酒店,Google
2023-11-01,五星級飯店，服務好，19樓非常棒，超級讚！,5.0,5.0,5.0,5,台北晶華酒店,Google
2023-11-01,交通便利.地點精華,,,,4,台北晶華酒店,Google
2023-10-31,飯店房間開始感覺有點過時，但總的來說，這是一次很棒的住宿，我會再回來。屋頂上有一個游泳池，但由於水深，不太適合兒童。所有員工都非常友好。 5 樓有一個兒童俱樂部，但不幸的是它只在周五和周六開放。適合 1 歲和 4 歲孩子的完美玩具/遊戲。我喜歡脫鞋規則。我認為玩具最適合 5 歲及以下兒童。飯店的早餐很豐富，也很方便。我發現有趣的是他們使用物理重金屬鑰匙打開房間。我擔心它會放錯地方，因為它沒有鑰匙孔，但這讓我們格外小心，不要失去它。我們帶著 2 個幼兒在 5 樓的陽台套房總共住了 2.5 週——非常適合孩子，因為兒童遊戲室就在附近。我們從來沒有使用過小陽台區域，因為它不是那麼乾淨，而且知道我們的孩子在那裡玩耍肯定會變得非常髒。我必須說，服務和員工都非常出色。我們需要的任何東西他們都會迅速處理。,5.0,5.0,5.0,5,台北晶華酒店,Google
2023-10-31,萬聖節快樂,,,,5,台北晶華酒店,Google
2023-10-31,萬聖節快樂🎉,,,,5,台北晶華酒店,Google
2023-10-31,萬聖節快樂,,,,5,台北晶華酒店,Google
2023-10-31,萬聖節快樂🎃,,,,5,台北晶華酒店,Google
2023-10-31,萬聖節快樂,,,,5,台北晶華酒店,Google
2023-10-31,飯店依然獨特風格,4.0,4.0,5.0,4,台北晶華酒店,Google
2023-11-02,不尊重客人，我們來等朋友，跟朋友約這裡等，直接把我們趕走，一般飯店是不能趕客人走的，這家飯店的主管大爛人一個，請大家不要再去消費，我也會跟我朋友說，請他們以後不要來這入住，又貴，又爛的飯店，隨便一家飯店都比他們家好太多了。,1.0,1.0,1.0,1,亞都麗緻大飯店,Google
2023-11-02,"10/31/23房間不大，但是有舒適的椅子，對商務客來講在上面工作用電腦，很方便,洗手台上面沒有擦手的小毛巾，倒是有點奇怪 房務工作很重要，但是可能人手不足，少放了乳液，茶包喝完了，也不會補。 浴缸比較小。 冷氣如果開自動，會太熱。",4.0,4.0,4.0,4,亞都麗緻大飯店,Google
2023-11-01,我去台灣旅行期間在你們家住了 3 個晚上。 除了夜間以外，有會說日語的工作人員很有幫助。工作人員的客戶服務、房間、設施、飯店室內設計、早餐等都很完美。當我比較日本的住宿和早餐時，我發現缺乏熱情好客。以後去台灣還會再訂。謝謝你們為我的台灣之旅留下了美好的回憶。,5.0,5.0,5.0,5,亞都麗緻大飯店,Google
2023-11-05,Peter和Jason非常樂於助人，幫我們把行李從B2轉移到大廳,5.0,5.0,5.0,5,台北福華大飯店,Google
2023-11-05,丹尼爾和亨利在稱行李方面非常有幫助,5.0,5.0,5.0,5,台北福華大飯店,Google
2023-11-05,蓬萊村 菜很好吃 李經理服務很親切,,5.0,5.0,5,台北福華大飯店,Google
2023-11-05,亨利和傑夫幫忙尋找遺失在計程車裡的手機,5.0,5.0,5.0,5,台北福華大飯店,Google
2023-11-05,Linus和Jack非常熱情地講解地鐵路線,,,,5,台北福華大飯店,Google
2023-11-05,老飯店，但服務跟餐飲還是很不錯的,,4.0,4.0,4,台北福華大飯店,Google
2023-11-05,彩虹座👍👍👍櫃檯出納賴小姐，服務超讚，親切。♥️♥️♥️,,5.0,,5,台北福華大飯店,Google
2023-11-05,今天在江南春用餐遇到林經理，曲副理，及林俊甫領班，陳家萱領班等，接待都很誠懇親切，點餐很細心注意客人口味需求，服務品質非常好，另外，劉主廚對餐飲烹調管理亦很用心注意客戶需要。,5.0,5.0,5.0,5,台北福華大飯店,Google
2023-11-05,Ben和Henry很熱心幫忙詳細介紹台北的景點,5.0,5.0,5.0,5,台北福華大飯店,Google
2023-11-05,Kevin和Peter非常有愛心，幫助殘障人士推輪椅和進出計程車,5.0,5.0,5.0,5,台北福華大飯店,Google
2023-11-05,孔小姐推薦的菜很好吃 陳主任服務很好,5.0,5.0,5.0,5,台北福華大飯店,Google
2023-11-05,服務人員John Huang 服務親切、周到，住宿體驗良好！,5.0,5.0,5.0,5,台北福華大飯店,Google
2023-11-05,John huang 服務超好 細心介紹,5.0,5.0,5.0,5,台北福華大飯店,Google
2023-11-05,John Huang福華飯店服務很好,,,,5,台北福華大飯店,Google
2023-11-05,John Huang,5.0,5.0,5.0,5,台北福華大飯店,Google
2023-11-04,三樓江南春- 最佳副理- 曲副理、于副理、林俊甫,5.0,5.0,5.0,5,台北福華大飯店,Google
2023-11-04,彩虹座用午餐場地寬敞挑高30米非常的氣派，秀美副理待客親切有賓至如歸的感覺，食材新鮮價格合理值得推薦👍,,5.0,5.0,5,台北福華大飯店,Google
2023-11-04,太舊了,1.0,3.0,4.0,2,台北福華大飯店,Google
2023-11-03,優越的地理位置和床超級舒適。手機插頭有點短，但其他都很好。在紅木酒廊與瑪姬一起度過了最美好的體驗，同時幫助我們預訂了水療/按摩約會。提供了到達那裡的詳細說明、期待什麼等等。謝謝瑪姬！,3.0,5.0,5.0,4,台北福華大飯店,Google
2023-11-03,非常感謝江南春林經理，曲福利非常體貼的服務，而且每次都幫我安排的非常體面，來這裡不會丟面子的，順帶一提，醉雞、烤鴨真的太好吃！,5.0,5.0,5.0,5,台北福華大飯店,Google
2023-11-03,11/3午餐來到常常造訪的珍珠坊，突然發現換了很多新菜色，點來嚐鮮、果真道道是美味、真是用心。還有孔小姐親切熱情的服務、真是太棒了，開心😃！,,5.0,5.0,5,台北福華大飯店,Google
2023-11-03,珍珠坊食物很好吃，服務人員孔小姐態度佳，會再來,,5.0,,5,台北福華大飯店,Google
2023-11-03,非常感謝江南春曲淑雯副理，林宏懋經理熱情的款待，讓我每次都吃到好吃的菜，非常滿意,5.0,5.0,5.0,5,台北福華大飯店,Google
2023-11-03,房間是舊了一點，不過算很乾淨,5.0,5.0,5.0,5,台北福華大飯店,Google
2023-11-02,不錯的酒店，工作人員非常友好。,5.0,5.0,4.0,5,台北福華大飯店,Google
2023-11-02,很好吃👍,5.0,5.0,5.0,5,台北福華大飯店,Google
2023-11-01,Kevin很有耐心解說我的問題,4.0,5.0,4.0,4,台北福華大飯店,Google
2023-11-01,服務態度,,,,5,台北福華大飯店,Google
2023-11-01,禮賓團隊的 John Huang 非常樂於助人！在台北時強烈推薦這家飯店。,5.0,5.0,5.0,5,台北福華大飯店,Google
2023-10-31,健身房女性工作人員非常不友善!,,2.0,4.0,3,台北福華大飯店,Google
2023-10-31,來這裡不是住宿，是和同學到1樓的酒吧聚聚，開心的喝飲料和點心，沒有時間限制呦！剛好是萬聖節活動，服務人員也很認真佈置與招待我們呦！ 咖啡好喝，點午茶套餐咖啡可以續杯，很讚！,,5.0,5.0,5,台北福華大飯店,Google
2023-10-31,果然五星級飯店 餐點好 服務也非常好 很棒的體驗,,,,5,台北福華大飯店,Google
2023-10-31,台北老飯店，服務多年來仍一流。,4.0,4.0,5.0,5,台北福華大飯店,Google
2023-11-05,位置優越，但時尚的室內設計有點過時。自助早餐很棒，但在到處都是反光石板和蜿蜒的佈局之間，很難找到某些食物區。不過服務是一流的！,,,,4,台北W飯店,Google
2023-11-04,品質有到位的高級飯店，參加研討會的體驗也不錯❤️❤️,5.0,5.0,5.0,5,台北W飯店,Google
2023-11-03,服務很棒，所有的工作人員都很有禮貌，樂於助人。由於 LGBT 慶祝活動正在進行，入住或退房時出現了一些問題。劇組處理得很好。我們喜歡這裡的位置，街對面的百貨公司有我們需要的所有餐廳、商店或戶外酒吧。這是一次有趣的經驗！,5.0,5.0,5.0,5,台北W飯店,Google
2023-11-06,剛好遇到三溫暖維修🥲也沒有事前通知 早餐沒有味增湯 泳池沒有音樂😐 房間中規中矩,4.0,4.0,3.0,2,台北君悅酒店,Google
2023-11-05,對花藝佈置的廠商態度不好，已經說明為何走錯員工出入口，也說方向並不是很熟悉，地下員工通道猶如迷宮，也多次道歉造成不便，但一樓大廳的一位綁馬尾戴眼鏡歲數大概50幾歲的大姐，還反咬牙說我態度不佳，還一直迂迴說對他的主管造成困擾，我說的內容是“我就算是佈置人員，也是消費者，不上班妳也是消費者，就不能好好的說話，或是給予一點通融嗎？”，對方還說她們是五星級的飯店，不允許這樣行為讓飯店覺醜陋？還說要禁止我們進場,,1.0,1.0,1,台北君悅酒店,Google
2023-11-04,很棒的酒店，真正的豪華，有很棒的食物選擇。,5.0,5.0,5.0,5,台北君悅酒店,Google
2023-11-04,很棒的旅宿場所和選擇。,5.0,5.0,5.0,5,台北君悅酒店,Google
2023-11-03,好停車。,,,,4,台北君悅酒店,Google
2023-11-03,第一次來君悅飯店舉辦活動，整體裝潢風格相當奢華氣派，有種歐式建築的浪漫氛圍，ㄧ進大廳就被大廳給美到了！飯店人員服務也很周到，很盡心盡力協助我們完成活動，但有點美中不足的是我們檢查餐具的時候有點不乾淨，畢竟是吃飯的場合，餐具的清潔度我認為是蠻重要的，不過告知飯店人員後也有積極去處理問題，整體而言辦活動是相當不錯的飯店唷！,,5.0,5.0,4,台北君悅酒店,Google
2023-11-01,去吃「彩」日式料理，生魚片好吃，但選擇比較少,4.0,4.0,4.0,4,台北君悅酒店,Google
2023-10-31,很棒..但就價格而言，迷你吧應該像希爾頓一樣免費，並且有更多選擇,5.0,5.0,5.0,5,台北君悅酒店,Google
2023-11-06,港式飲茶味美,4.0,4.0,4.0,4,兄弟大飯店,Google
2023-11-05,梅花廳港飲好吃又物超所值。,,5.0,5.0,5,兄弟大飯店,Google
2023-11-05,飲茶🫖👍,,,,5,兄弟大飯店,Google
2023-11-05,捷運復興站,4.0,5.0,5.0,5,兄弟大飯店,Google
2023-11-04,服務人員們親切又有禮，讓人覺得溫暖又賓至如歸，早餐用餐氣氛很悠閒不吵鬧，很愉快的住宿經驗,5.0,5.0,5.0,5,兄弟大飯店,Google
2023-11-03,位置好交通方便。麵包都很好吃，但客人多排隊，又常有人由小門進出，端著面包閃客人相當不便，如能加入悠遊卡或信用卡加速結帳速度会好很多，請思考一下。另時隔多年再吃烤白菜少了点火喉鍋氣，也沒有牽絲，上面那皮跟記憶中不同了，傷心…，但蜂巢荔芋角还是一樣好吃，愛店請加油!,,3.0,5.0,3,兄弟大飯店,Google
2023-11-03,餐點好吃服務用心,,,,5,兄弟大飯店,Google
2023-11-02,房間安靜乾淨餐點也好吃 飛馳喜歡,,,,5,兄弟大飯店,Google
2023-10-31,"冷氣很強,服務很好",4.0,4.0,4.0,4,兄弟大飯店,Google
2023-10-31,老飯店囉， 推一樓麵包店和旁邊的蛋糕品項， 二樓飲茶和B1日式料理～ 其他餐廳就看個人喜好，也都可試試。在萬物齊漲的現在， 兄弟飯店還是值得去得 ～,4.0,4.0,5.0,5,兄弟大飯店,Google
2023-11-06,下午茶 吃粗飽,,5.0,,5,台北寒舍喜來登大飯店,Google
2023-11-06,台北喜來登大酒店位於台北市中心，毗鄰捷運站，是地理位置近乎完美的美麗飯店。房間感覺比我去過的其他喜來登酒店小（可能是因為這家酒店比較舊，而且位於一個需要小占地面積的地區。,5.0,5.0,5.0,5,台北寒舍喜來登大飯店,Google
2023-11-05,不需要說什麼，一切都很好,5.0,5.0,5.0,5,台北寒舍喜來登大飯店,Google
2023-11-05,我住得很舒服。早餐豐盛可口。 房間也寬敞漂亮。,5.0,5.0,5.0,5,台北寒舍喜來登大飯店,Google
2023-11-05,房間有點過時，但仍然乾淨舒適。完美的位置不僅僅彌補了房間的不足。,3.0,4.0,5.0,5,台北寒舍喜來登大飯店,Google
2023-11-05,位置很方便，離台北車站很近。設施有點舊，清潔也不是很好。還有日本工作人員，但他們的語言很蹩腳，有些人跟我們溝通有點困難。房間裡的電話上還有一個日語按鈕，但當我按下它時，它會說英語。不過，看來住在那裡的日本客人還蠻多的。,3.0,3.0,4.0,3,台北寒舍喜來登大飯店,Google
2023-11-04,行政酒廊不錯,,,,5,台北寒舍喜來登大飯店,Google
2023-11-04,自助晚餐很棒,5.0,5.0,5.0,5,台北寒舍喜來登大飯店,Google
2023-11-03,進入大廳寬敞開放，感覺很好,4.0,4.0,4.0,5,台北寒舍喜來登大飯店,Google
2023-11-03,餐點好吃,,,,5,台北寒舍喜來登大飯店,Google
2023-11-02,地點好在市中心往那個方向都方便,5.0,5.0,5.0,5,台北寒舍喜來登大飯店,Google
2023-11-01,商旅早餐跟一般早餐分開而且還差很多，有夠無腦的服務，ㄧ晚快ㄧ萬感覺住了個寂寞！,,,,1,台北寒舍喜來登大飯店,Google
2023-10-31,看來在台北還算挺不錯的飯店，而且地點便利，就在地鐵旁邊。日本客人很多，但飯店前台的工作人員不會說日文！我必須使用智慧型手機的翻譯功能才能度過難關。房間感覺有點舊，但還算乾淨，廁所水量也還可以，不用擔心✨感覺位置有點不方便，觀光時轉地鐵有點不方便..,4.0,3.0,3.0,4,台北寒舍喜來登大飯店,Google
2023-11-06,人員服務親切，外場收拾的速度也很快，雖然我們是12:10才進場，但餐點的量都還算豐盛，搭配餐券使用，CP值很高，很棒！ 娶餐不用排隊，雖然午餐的用餐人數不少，卻沒有一般網紅餐廳的人多吵雜，算是舒服的用餐環境。,,5.0,4.0,5,台北凱撒大飯店,Google
2023-11-06,二樓自助餐讓我非常失望，不如吃麻辣鍋或熱炒，疫情前都還蠻不錯的，但這次吃蝦子海鮮沒有很新鮮，壽司沒了也沒補，牛排很快冷掉，其他的菜品的味道沒有到味，很難想像是要花1000多元的自助餐,,,,1,台北凱撒大飯店,Google
2023-11-05,凱撒飯店裡面的星巴克服務超爛還要加收10%服務費，碰到菲律賓人講英文就很客氣，對台灣人極為不友善！,,1.0,,1,台北凱撒大飯店,Google
2023-11-05,這家旅館就在車站旁邊，讓你出行更方便，但是，你實際上並不需要它，在台北遊覽非常方便，而且對遊客很友好，嘗試住在一個安靜的地方，這樣更放鬆。以台灣標準來說，房價太高了，我覺得不值這個錢，台北有很多選擇，而且還很便宜。,4.0,4.0,5.0,4,台北凱撒大飯店,Google
2023-11-03,餐點很好吃。下次還會去！,,5.0,5.0,5,台北凱撒大飯店,Google
2023-11-03,優越的地理位置、飯店住宿、服務和環保，😸☺️,,,,5,台北凱撒大飯店,Google
2023-11-01,令我印象深刻的國際級酒店 在台北市歷史久遠 却帶有現代感的氛圍，除了旅外人士與日本旅客入住常客外 餐食服務與spa服務都令人滿意 房型有很多皆為現代感室內設計 一樓有餐廳 也有川菜 等 選擇性高 附近交通便利 如果是出差行程 很推薦 如果時間允許 可以安排Spa館服務 體驗放鬆心情療程 都相當不錯,5.0,5.0,5.0,5,台北凱撒大飯店,Google
