review_date,review_text,amenities_score,service_score,location_score,overall_rate,review_hotel,review_source
2023-11-24,優點：晚餐和早餐都好吃，房間也不錯。 缺點：這次入住一泊二食三間半露天風呂套房，事先要求其中兩間房間要提供老人用的設備，結果飯店提供給我們的有老人設備的房號錯誤，害我們換房換了好幾次。預訂素食餐卻提供非素食醬油，幸好素食者自己注意到味道才沒有誤食。最差勁的是員工會侵佔客人忘記帶走的物品，有一間房的插房卡處插了無記名的悠遊卡，退房時忘記拿走，後來打電話去飯店詢問僅得到沒看到的答案，員工的教育有問題，無記名悠遊卡等同現金，員工竟然會侵佔客人的錢，入住這間飯店要小心自己的貴重物品喔！ 2023/11/23更新：發出評論的隔天，飯店業務帶著禮物和卡片至幫我們訂房的旅行社致歉，不過我們並未接過飯店詢問我們的遺失物的電話，總之幸好最後還是找回卡片了。,4.0,1.0,5.0,2,北投日勝生加賀屋國際溫泉飯店,Google
2023-11-23,泡湯泡湯，一向喜歡新飯店的設備。平日泡湯很容易包池。北投有青、白、鐵磺湯，亞洲只有日本秋田縣和北投才有青磺喔。,5.0,5.0,5.0,5,北投日勝生加賀屋國際溫泉飯店,Google
2023-11-26,很乾淨 很適合和家人一起去,4.0,5.0,5.0,5,南豐天玥泉會館,Google
2023-11-26,湯屋乾淨清潔，服務親切，還有餐廳喝咖啡,5.0,3.0,5.0,5,南豐天玥泉會館,Google
2023-11-26,它距離神北投站僅幾步之遙。 旅館距離許多餐廳和便利商店僅有很短的路程。 搭乘Youbike 前往家樂福僅需10 分鐘。 早餐品種不是很多，但是簡單吃一頓也夠了。 有麵包、沙拉、一些肉和米飯，所以你可以吃得很好。 我預訂了一間有 2 張大床的房間，可供 4 人入住。 有茶几，沙發，還有足夠的空間放一張床。（7樓） 房間沒有窗戶，但浴室和大型家庭浴室的一側有窗戶，所以通風良好。還有冰箱，並提供迎賓飲料和水。 咖啡壺很乾淨，也提供茶和一些點心。 家庭浴池的浴缸排水很好，溫泉水流出也很好。 工作人員很友好。我搭計程車遇到了問題，他們很友善地幫助了我。,5.0,5.0,5.0,5,南豐天玥泉會館,Google
,不錯。,,,,4,陽明山天籟渡假酒店,Google
2023-11-26,就陽明山的五星級溫泉飯店 其實沒什麼好選的 其他周邊都三級 難以匹敵,,,,4,陽明山天籟渡假酒店,Google
2023-11-23,假日晚餐是自助餐，餐點可選擇性超多，好吃，品質和服務都很棒。 住的房間很大，很乾淨整潔，體驗很棒。,5.0,5.0,5.0,5,陽明山天籟渡假酒店,Google
2023-11-21,涼秋微雨，從金山上來路不遠好開。好湯好山好水好悠閒的一天，早餐精緻可口。,5.0,5.0,5.0,5,陽明山天籟渡假酒店,Google
2023-11-21,露天溫泉很棒，可以提早去泡溫泉。房間也有半露天溫泉。早餐的選擇很多樣，她還把金山的排隊名產都擺上了。 露天溫泉區種了幾棵櫻花，等櫻花開再來,5.0,5.0,5.0,5,陽明山天籟渡假酒店,Google
2023-11-26,訂的薄荷湯屋沒有氣氛可言 非常一般 完全不值得這個價格 裝潢也很一般 不像星級湯屋 跟網路照片不符合,3.0,5.0,2.0,2,北投麗禧溫泉酒店,Google
2023-11-26,來湯屋泡湯90分鐘十分滿意的體驗。一定會再回來。交通也很方便從北投公車站坐小25/230 再走2分鐘就到。也可坐他們的接駁車。,5.0,5.0,5.0,5,北投麗禧溫泉酒店,Google
2023-11-26,"Apart from the mini gym (no weight training equipment), everything is perfect: spectacular view of the Japanese style Beitou Museum; large hot tub; wide choice of complimentary drinks, tea, snacks 除了健身房太迷你(沒有重訓器材)之外，一切都很完美：日式北投文物館的一流景色；大溫泉缸；附送多種飲料、茶、點心",5.0,4.0,4.0,5,北投麗禧溫泉酒店,Google
2023-11-25,很棒的湯屋，櫃檯小姐動作快服務很好，停車位有點太小格，不好停,5.0,5.0,5.0,5,北投麗禧溫泉酒店,Google
2023-11-25,環境非常棒，景色好、乾淨整潔， 且服務人員親切有禮🌈💜謝謝！ 祝福全世界幸福美滿🥰,5.0,5.0,5.0,5,北投麗禧溫泉酒店,Google
2023-11-24,一個人的獨處～靜 一個字的形容～美,,5.0,5.0,4,北投麗禧溫泉酒店,Google
2023-11-23,高級、用心、體貼入微 特別要讚揚櫃檯淇芳小姐非常優秀，親切體貼，讓人賓至如歸,5.0,5.0,5.0,5,北投麗禧溫泉酒店,Google
2023-11-23,在山上走路很累，不过有接驳车，90min 2500台币。 (由 Google 提供翻譯) 在山上走路很累，不過有接駁車，90min 2500台幣。,5.0,5.0,3.0,5,北投麗禧溫泉酒店,Google
2023-11-22,帶韓國客人去他們很開心,,4.0,5.0,4,北投麗禧溫泉酒店,Google
2023-11-22,買了卷，忘了用， 都快到期了， 趕緊預約去,5.0,5.0,5.0,5,北投麗禧溫泉酒店,Google
2023-11-21,值得再來的好地方,5.0,5.0,5.0,5,北投麗禧溫泉酒店,Google
2023-11-21,半露天湯屋很棒， 泡湯有私密性的同時，空氣又很清新，休息的空間也很舒適，可以吃奶酪還可以泡茶，備品也很齊全，值得再次到訪。,5.0,5.0,5.0,5,北投麗禧溫泉酒店,Google
2023-11-21,環境硬體以及櫃檯人員五顆星 樓下服務人員2顆星 11/16晚上和妹妹到北投麗禧酒店泡湯 環境很好 乾淨舒服 接駁車和大廳接待人員都很熱心 感受得到真心的服務 不過到了樓下湯屋 櫃檯男士感覺照本宣科 服務沒有熱忱了 從安排房間到帶位湯屋 都是面無表情照本宣科的介紹 對於顧客的詢問也不理會 自顧自的講 兩三次完全感受得到他不想理會我的詢問 要帶我們到湯屋的時候 因為我還在座位區確認是否有東西遺漏沒有帶走 加上剛回國膝蓋發炎疼痛走得比較慢 該服務員明知道我還在後頭 自顧自的帶著妹妹往前一直走 完全沒有要等我 也讓妹妹一直回頭看我不知所措 因為是妹妹帶我來泡湯 不想掃興 否則我真想當面直接提醒那位人員注意一下自己的服務 我都還沒跟上 就一直自顧自的在介紹（還講得很快）感覺只是為了走完SOP流程 顧客全程根本沒聽清楚 其實真的沒有意義！,5.0,1.0,4.0,2,北投麗禧溫泉酒店,Google
