review_date,review_text,review_rate,review_hotel,review_source
2021-12-25,地點好交通方便，大班廊服務超級熱忱，是我最好一次的行政酒廊體驗，早餐種類超多，設施服務人員都很主動爲客人服務。隔音就比較普通，但不至於影響睡眠。,10.0,台北晶華酒店,Agoda
2021-12-21,好飯店,,台北晶華酒店,Agoda
2021-12-20,非常喜歡晶華，每年一定要來住好幾次才行,10.0,台北晶華酒店,Agoda
2021-12-20,這次住18樓 view 很好 早餐自助餐吃很飽,10.0,台北晶華酒店,Agoda
2021-12-19,櫃檯小姐服務親切，笑容可掬,,台北晶華酒店,Agoda
2021-12-17,員工表現很棒，有五星飯店的水準，早餐也很不錯！推薦日式飯捲必吃，唯一美中不足的就是房間看出去的景真的不是很美,10.0,台北晶華酒店,Agoda
2021-12-17,服務很好，早餐也好吃！非常願意下次再來,10.0,台北晶華酒店,Agoda
2021-12-16,不建議把沙發床展開，空間會小很多，夜景相當優,,台北晶華酒店,Agoda
2021-12-14,服務態度,10.0,台北晶華酒店,Agoda
2021-12-13,這次因為生日，給自己一個放鬆的假期，飯店很貼心送上蛋糕，讓自己靜靜度過生日不會孤單，帶點溫暖：）,10.0,台北晶華酒店,Agoda
2021-12-13,第一次入住晶華飯店～整體環境感覺舒適整潔乾淨，房間空間大～服務人員態度良好，早餐餐點好吃～缺點離捷運站遠一些些，步行約10分鐘,,台北晶華酒店,Agoda
2021-12-12,冬天這個價位有溫水游泳池挺好的 泳道很寬很舒服,,台北晶華酒店,Agoda
2021-12-11,這次訂了三間房，有帶小孩，覺得晶華很適合有小孩的家庭來住。唯有一點比較在意是：130cm以下的小孩要收早餐錢，這我們能接受且前一晚已知情，但進入吃早餐的現場並未有量測身高的動作，僅退房結帳時告知「有一位孩童需收費」，詢問家人後才知小朋友其實是129cm. 並非不願付出費用，而是覺得需要被告知，這點若能改進會更好。,,台北晶華酒店,Agoda
2021-12-10,真的很棒五星酒店真的名副其實,,台北晶華酒店,Agoda
2021-12-09,酒店所在位置很棒 附近也蠻多商家可以購買 酒店內的服務都很棒 早餐種類也很多 有些餐點都是現點現做的 好吃 已入住多次 幾乎成為唯一選擇,10.0,台北晶華酒店,Agoda
2021-12-06,早餐非常好吃，有機會會再入住,10.0,台北晶華酒店,Agoda
2021-12-02,對於開車的旅客來說真的很困擾，雖然說住宿期間可以免費自由進出停車場，但是若車位已滿也是要排隊等待，以五星級飯店來說非常非常扣分 另外寢具透氣性差，冷氣開很冷了還是睡到滿身汗，枕頭過軟，不管睡一個還是兩個都不好睡 浴缸很大，泡澡很舒適，但是附贈的沐浴鹽裡面有不知道是壓克力還是玻璃的碎片 早餐沒有想像中的驚艷，有名的牛肉麵更是覺得很失望 整體來說同樣價位的飯店可以得到更好的住宿品質，不會推薦別人住,,台北晶華酒店,Agoda
2021-12-01,很好,,台北晶華酒店,Agoda
2021-12-01,地理位置很好，離中山捷運站步行約10分。check in時人潮很多雖有實行分流但還是有點混亂還好工作人員都還是很有耐心指引。只是客房內浴室的浴缸還是有點不乾淨上面有些污漬和頭髮。,,台北晶華酒店,Agoda
2021-12-01,帶著嬰兒一起旅行，因為必需餵母奶，一直麻煩飯店員工處理母奶的存放，員工們也都非常好的為我們處理,10.0,台北晶華酒店,Agoda
2021-11-30,飯店&餐點都很棒,10.0,台北晶華酒店,Agoda
2021-11-29,會想再來~~~~~,10.0,台北晶華酒店,Agoda
2021-11-26,服務好.入住滿意,10.0,台北晶華酒店,Agoda
2021-11-23,週五國旅好多人出遊 ， 現場加價1000升級17坪寰宇套房，walk in 更衣室，kingsuze bed 空間大許多，也很乾淨但怎沒看到迎賓水果。 1樓咖啡廳餐飲不錯就是價位高些，晚間有演奏祝唱很熱鬧，隔天外帶回的栗子磅蛋糕也不錯。,,台北晶華酒店,Agoda
2021-11-22,這裡是我住過 最貼心且優質的飯店囉～,10.0,台北晶華酒店,Agoda
2021-11-22,服務人員態度親切、用餐環境舒服.房間乾淨整潔 是渡假飯店首選,10.0,台北晶華酒店,Agoda
2021-11-22,柏麗廳早餐選擇多樣，我吃到的色香味都具有高水準。,,台北晶華酒店,Agoda
2021-11-21,床偏硬，客房整潔，早餐多樣化，可是自助餐飲沒有過去好吃,10.0,台北晶華酒店,Agoda
2021-11-21,人太多,,台北晶華酒店,Agoda
2021-11-16,美好的早餐，優質的大班酒廊 酒廊服務非常好，下午茶很可惜輸給香格里拉的豪華閣 但是晚上的HH，不論是調酒或是熱食，都非常不錯，值得入住。,10.0,台北晶華酒店,Agoda
2021-11-16,"早餐真的優秀,房間乾淨且空間大,只是住客真的蠻多的,櫃檯服務有時候需要等待,但整體而言,還是很值得再訪的飯店",10.0,台北晶華酒店,Agoda
2021-11-15,1. 看得出晶華飯店住房內的設備較為商務式傳統，不過整體來說維持的不錯，房間內很整潔！ 2. 健身房不只有跑步機跟飛輪(很多五星級飯店健身房只有這兩款運動器材)，一些該有的健身設備俱全，雖設備不是太新，但這一點已經很棒！ 3. 非常期待柏麗廳的早餐，早餐方面中式、西式、日式該有的都有，不過沒有到令人驚艷，沒有較高階的食材比較可惜，例如：煙燻鮭魚、牛肉等，後續可能不會為了想要享用飯店早餐而特別安排住房！ 4. 住宿目的是慶生，感謝飯店贈送一個四吋小蛋糕，這一點備感溫馨！ 5. 地點真的是方便，這點推薦給國外及沒開車的旅客！ 6. 停車位：蠻多飯店停車位置很小、或是機械式停車位，晶華的停車位很明亮、舒服及整潔，且有人管理，讓愛車停在飯店地下室覺得很放心，這一點很推薦！,,台北晶華酒店,Agoda
2021-11-15,環境舒適、餐點美味。,10.0,台北晶華酒店,Agoda
2021-11-11,其實除了房間大，有附自助式早餐，雖然還有三溫暖游泳池健身房，但是沒用到，小可惜。其他...就是住一個高級飯店的名義而已啦,,台北晶華酒店,Agoda
2021-11-08,乾淨整潔，服務人員態度很棒，第一次看到還有使用較為傳統的鑰匙真的很特別，甚至是在我退房時，也說歡迎下次再來，說真的，我住了其他間飯店不像晶華酒店一樣服務很棒，甚至是在我離開時飯店也幫我叫了計程車到台北車站,10.0,台北晶華酒店,Agoda
2021-11-07,老牌的五星級酒店，房卡是以傳統的金鑰匙，覺得很特別，各項設施都很齊全，房間空間很大，附近機能交通機能很好，值得推薦體驗,10.0,台北晶華酒店,Agoda
2021-10-25,房間大，設備翻新過非常符合目前住宿需求，例如床頭邊有USB充電座以及免治馬桶，服務人員親切，早餐非常棒同時牛排店也提供高水準餐飲。 開始說缺點，停車場明顯負荷不足，光是等待車位可以浪費掉40分鐘，入住前先考驗耐心，另外，非常容易停電，2021/10/23晚間約10點停電一小時，2021/10/24早上11點又停電一小時，想體驗洗澡到一半忽然伸手不見五指的感覺可以考慮入住，這建築物明顯有電力供應的問題缺不改善，要入住請多注意,,台北晶華酒店,Agoda
2021-10-22,樓上房客有很大的噪音 聯絡櫃台馬上幫我們處理 小刮傷還提供OK绷給我們 跟客服要甚麼有甚麼 服務真的很到位又很客氣專業 我們簽約的方案還有附紅白酒給我們 頂樓游泳池也乾淨設施完善 停車折抵也完全沒有疑問 整體是很棒的一次體驗,10.0,台北晶華酒店,Agoda
2021-10-18,房間舒適,,台北晶華酒店,Agoda
2021-10-17,住宿環境高雅舒適，房間寬敞，早餐很好吃，服務人員也親切體貼，但唯一美中不足的是紅酒杯需要另外付費使用。五星級飯店應該要免費提供酒杯服務,10.0,台北晶華酒店,Agoda
2021-10-13,服務很好,10.0,台北晶華酒店,Agoda
2021-10-12,餐點、活動及住房體驗都非常喜歡,10.0,台北晶華酒店,Agoda
2021-10-11,地理位置優良，服務人員服務良好，房間舒適整潔。,10.0,台北晶華酒店,Agoda
2021-10-11,"服務水平有點出乎我意料的低於水平, 對於五星老牌酒店而言不論任何崗位的員工應該都要訓練有素, 然而在入住的期間發生不大不小的插曲讓我有些意外. 一是在乘坐電梯時已踏入梯間卻被打掃人員叫出, 並告知電梯要做清潔轉坐別台電梯, 雖然知道該清潔員在做份內工作, 但禮貌上客人都進了電梯應該要等候下一輪再做清掃而非讓客人換程. 二是早餐的點單服務員大概是忙昏頭了, 沒有給菜單也沒有給做任何介紹的情況下, 一上前就問我要點什麼? 大眼等小眼幾秒後見他也沒意識到有什麼問題, 無奈只能自己從服務員手上抽出點單自己填寫... 整體服務: 前台人員優, 其餘員工待加強訓練 房型: 寬敞舒適, 格局方正, 物超所值 建築動線: 可能是因為老建築, 整體動線很迷惑, 從地下商店街上大堂總會被繞暈. 地下停車場的樓高也特別矮, 開大型休旅車的朋友要特別注意",,台北晶華酒店,Agoda
2021-10-11,位置好，環境好，乾淨，服務也好 唯一缺點是大廳下地下室電梯只有一部，要排隊！ 上房間六部電梯也是有點慢！ 早餐太多人也要排隊！,,台北晶華酒店,Agoda
2021-10-10,👍喔！,10.0,台北晶華酒店,Agoda
2021-10-10,晚上八點半左右要1桶冰塊，打電話催了3次，拖了40分鐘才送來，最後負責送來的小姐還臭臉，單手遞就算了，一句抱歉也沒有。如果不提供這個服務可以直說，我們自己出去買快多了。,,台北晶華酒店,Agoda
2021-10-07,房間寬敞，浴室裡還備有泡澡的浴鹽，超貼心。 面公園的房型還可以看到101，跨年來看煙火一定很棒！ 服務人員專業有禮貌充滿熱忱，不愧是五星級飯店水準。 這次行程是幫老公慶生，入住就給小生日蛋糕兌換卷，晚餐我們直接在Robin’s牛排屋用餐，吃飽喝足回房間倒頭就睡，也不用擔心喝酒還要開車回家。 唯一美中不足的是早餐稍嫌普通了些，建議可以增加特色餐點。,,台北晶華酒店,Agoda
2021-10-05,點了飯店餐廳的烤鴨跟港點，真的好美味。房間整潔。一切都很好。,10.0,台北晶華酒店,Agoda
2021-10-05,問了客房又轉櫃台櫃台又轉總機總機又轉延誤我們點餐時間...這樣的流程與方式不是很好! 除了此其餘服務都好。,,台北晶華酒店,Agoda
2021-10-04,原本想說趁著疫情有划算前去住宿，飯店房間有問題，櫃檯也很客氣處理問題，五星飯店服務真的沒問題，但目前早餐部分是沒有自助的，入住的時候也沒有說明，以致於一早去吃早餐結果東西真的不如預期，非常普通的商務早餐，算是蠻失望的體驗...,,台北晶華酒店,Agoda
2021-10-02,一開始給的豪華雙人房的洗手台有留下前房客的干掉的「隱形眼鏡」，浴室還有些水痕留下，感覺很不舒服。 但是跟櫃檯反應後，就更換房間了，櫃檯服務跟早餐都讚啦！美中不足就是那個可怕的前房客留下的隱形眼鏡。,,台北晶華酒店,Agoda
2021-09-29,帶爸媽一起入住，服務人員親切有禮。飯店交通位置方便，早餐很美味，有機會一定會再入住!,10.0,台北晶華酒店,Agoda
2021-09-27,"當天入住前3,4小時,請飯店調整大床與嬰兒床配置,本想說這麼臨時可能沒法處理好,沒想到一樣是照我最後要求的安排 晚上的星空影院一樣很棒!!!~床跟枕頭睡起來很舒服~~ 可惜,隔天早餐享用真的扣分,早餐用外帶餐盒包裝這個我可以接受,畢竟疫情期間,但送來時沒有附餐具,打了一次兩次客服才有人接,說明沒有附餐具後,客服說會請人安排,等了十幾分鐘依究沒人送來,只好再打客服第二次,才送到...餐都冷了,肚子也餓了...真的是扣分~><""...希望只是因為疫苗關係影響",,台北晶華酒店,Agoda
2021-09-26,舒適的行程,,台北晶華酒店,Agoda
2021-09-23,雖然本身住宿費用稍高 但整體設施和服務品質絕對遠超這價位！ 可惜疫情 部分設施受限 期待未來疫情結束能再次拜訪,10.0,台北晶華酒店,Agoda
2021-09-22,4瓶美酒很讃，但晚餐外帶餐點真的很不優，失了晶華美食的口碑，可惜了！,10.0,台北晶華酒店,Agoda
2021-09-22,防疫期間用餐，看得見有用心規劃,,台北晶華酒店,Agoda
2021-09-21,很讚,10.0,台北晶華酒店,Agoda
2021-09-21,以前生日當周會有蛋糕，後來好像沒有了，有點可惜,,台北晶華酒店,Agoda
2021-09-13,飯店雖然有點歷史，但維持的很好員工素質很棒，特別是早餐是我住過飯店裡最棒的菜色很多種,,台北晶華酒店,Agoda
2021-09-12,這次入住的房間特別升等，非常開心。 唯一的小缺點就是，房間內的電視節目好像無法正常觀看。,,台北晶華酒店,Agoda
2021-09-12,這次入住的房間隔音感覺比較差，會聽到隔壁別人的說話聲。 另外，浴室的免治馬桶是壞掉的，無法正常使用，但沖水沒問題。,,台北晶華酒店,Agoda
2021-09-09,下午3:30去。竟然停車位不足。等了20分鐘才有位子。若是晩餐時間根本不會有車位,,台北晶華酒店,Agoda
2021-09-07,吹風機風力有些弱，浴室地板有毛髮外， 其他都很棒,10.0,台北晶華酒店,Agoda
2021-09-05,在疫情期間，電梯每次搭到2樓大廳就有服務人員清潔按鍵，隨處有酒精消毒裝置。 舒適的客房，有雙門可確保隱私 唯一枕頭有點軟⋯,10.0,台北晶華酒店,Agoda
2021-09-05,飯店位置好，樓下就有lady M 房間地板很多碎屑，清潔有待加強 因疫情期間早餐改成套餐，品質極差 西式套餐麵包燒焦，太陽蛋也燒焦，完全不推薦加購飯店早餐 以五星級飯店品質，完全不推薦,,台北晶華酒店,Agoda
2021-09-04,雖然飯店比較老，但是設施維護的不錯，整體的服務水準令人滿意，疫情期間早餐提供的是套餐，如果再有多一點選擇，那就更棒,10.0,台北晶華酒店,Agoda
2021-09-01,即使當天入住入數眾多，服務人員服務品質仍舊很好且周到,,台北晶華酒店,Agoda
2021-08-31,"酒店整體回頭率100%,好想再來住宿,下次過節想再來住,早餐超棒的,員工男女顏值超高太養眼了",10.0,台北晶華酒店,Agoda
2021-08-30,泳池進不去，因為太多人。餐點等近一小時，因為太多人。訂兩間房一間有水果、一間沒有，一間冷氣不涼、一間冷得要命。中午就提早到想節省check in排隊時間，一樣等到3:30才進房間。一進了房間馬上換泳衣想去游泳，卻得到只能在烈日下現場排隊等待有沒有人願意離場才能有新的客人移入。整個莫名其妙胡說八道！聽說這種情況已經持續幾個週末，卻未見主管設法解決。對晶華的房務給95分，對經營管理人員解決問題的能力打50分。只想賣昂貴的便當海撈一點現金，自己飯店服務的本業都沒有意願顧了，現實至此，令人難堪。,,台北晶華酒店,Agoda
2021-08-23,推薦給還沒體驗過晶華酒店的朋友們！,10.0,台北晶華酒店,Agoda
2021-08-21,櫃台要多加強,,台北晶華酒店,Agoda
2021-08-21,提供延時服務 很棒的嬰兒床 澡盆 消毒鍋 對帶小寶寶出門的爸媽 有非常大的幫忙,10.0,台北晶華酒店,Agoda
2021-08-18,交通便利、位置優越,10.0,台北晶華酒店,Agoda
2021-08-16,離中山商圈很近，服務人員服務很好，在疫情期間的配套措施也很完善，下次會想再入住。,,台北晶華酒店,Agoda
2021-08-15,環境沉靜溫馨，員工服務滿分，貼心服務,10.0,台北晶華酒店,Agoda
2021-08-15,雖然是有年代感的旅館，但奢華與整潔一樣優質，服務也超好!,10.0,台北晶華酒店,Agoda
2021-08-08,舒適經典,10.0,台北晶華酒店,Agoda
2021-08-05,住宿都很棒，但是早餐要等半小時,10.0,台北晶華酒店,Agoda
2021-07-31,這次入住18樓的行政套房，因為疫情關係可以升等以及提早入住覺得非常貼心，room service也非常棒，如果電話的使用能更方便感覺有些按鍵無法使用或者比較老舊不好按，桌上的燈泡會閃造成眼精不舒適要汰換房間的一些物品，住宿體驗會更加，比較大的缺點部分，房間的隔音其實沒有很好，一直可以聽見隔壁或者樓上的聲音是比較不好的感受，再安排房客入住的房間如果能夠錯開或者適當安排會更好，大致上都非常舒適，尤其在服務品質沒話說，希望小缺點能夠感善，下次入住能夠有更好的體驗。,,台北晶華酒店,Agoda
2021-07-29,再台北讓人較為安心的飯店,10.0,台北晶華酒店,Agoda
2021-07-20,無論服務、整潔度、設備、餐點都是一流。,10.0,台北晶華酒店,Agoda
2021-07-19,在入住的三天兩夜中，雖然知道晶華酒店已經非常有歷史，但是許多貼心服務實在讓人窩心，從接待人員耐心詢問早餐、上樓也都有服務人員按電梯、房間內很貼心的一天準備五罐瓶裝水，免除打電話送水的困擾、備品也是精心準備⋯種種的因素讓我覺得值回票價，若還有機會在非警戒時期入住，我還想來嘗試看看大班閣。,10.0,台北晶華酒店,Agoda
2021-07-04,自助早餐很豐盛,10.0,台北晶華酒店,Agoda
2021-07-04,早餐很豐盛，房間很大。,10.0,台北晶華酒店,Agoda
2021-06-29,一流的服務跟設備，值得再訪。,10.0,台北晶華酒店,Agoda
2021-06-24,服務非常好，唯一缺點是隔音略差,,台北晶華酒店,Agoda
2021-05-23,滿分,10.0,台北晶華酒店,Agoda
2021-05-09,不用多說，就是讚，飯店知道此次為蜜月旅行，貼心準備蛋糕及小禮物，服務人員也是夠水準也很親切，非常棒！,10.0,台北晶華酒店,Agoda
2021-05-07,有很多規定，感覺都要服從，都不能夠有商量的餘地，但是門口的服務態度很好，他們很積極主動幫你開門，主動問你的需求，很棒。櫃檯的服務人員感覺很累沒有耐心，年紀大記不住，口氣上有點不耐煩,,台北晶華酒店,Agoda
2021-05-05,服務態度佳,10.0,台北晶華酒店,Agoda
2021-05-05,選擇多樣菜色豐富,10.0,台北晶華酒店,Agoda
2021-05-04,服務人員都很熱心的主動詢問客人的需求,10.0,台北晶華酒店,Agoda
2021-05-03,首先 感謝Front desk manager Kevin非常友好的安排客房，再來是感謝香港籍的Duty manager Jamie kwok即使遇到突發狀況也訓練有素，非常棒。此次入助早餐有點失望。希望能對素食者友善一些。常客ˋ的反饋希望你們能真的聽到。謝謝你們 。,,台北晶華酒店,Agoda
2021-05-01,很有品味,10.0,台北晶華酒店,Agoda
2021-04-29,原訂一般的2大床，後來升等寰宇2張大床家庭房，是邊間，所以有2扇超級大的落地窗，光線超讚。 喜歡： 1）飯店的每間房門後都有一個長方型的前廊玄關，離外面走廊有距離再加上到臥室還有一扇門可以關起來，所以外面走廊有聲音都不會聽到。 2）廁所全白色大理石很明亮，馬桶淋浴跟浴缸全分開，空間大。 3）整間房整理的很乾淨，沒有灰塵沒有發霉，這在我的上百間飯店住宿經驗，屬於前三名。 4）水壓超強 5）服務很好。 缺點： 1）床很硬跟ㄧ般五星級的飯店差很多，有被嚇到，第一晚完全睡不好。 2）電梯沒有控管誰都可以上樓 3）自助早餐真的不好吃，五星級飯店餐廳提供的咖啡竟跟3星的差不多。,,台北晶華酒店,Agoda
2021-04-27,整體而言，只有Buffet區比較滿意。 櫃檯白天時段全部都是香港實習生。姓氏可以叫錯，飯店的迎賓酒竟然是check in 直接四瓶重重的拿給客人，而不是放在房間。不然應該主動問客人要不要飯店的人幫忙送上去，還好我們行李沒有很多，這樣子讓客人自己拿行李又拿四瓶酒...。 還有我當天是壽星，問櫃檯後，他們竟然說是因爲我沒有備註，所以沒有🍰蛋糕。非常不貼心。 另外平日住宿照理來說應該有很多空房，房間竟然沒有升等。 三溫暖不錯，不過看得出來有點年紀，只能說應該要好好翻修一下了。,,台北晶華酒店,Agoda
2021-04-26,超貼心！ 餐聚回來比較晚，櫃檯人員還特意打電話來，告知12:30退房就行了,10.0,台北晶華酒店,Agoda
2021-04-26,地下室很多店逛一逛，整間飯店都有悠閒的音樂聲，在都市叢林就可以一秒有度假感，早餐很豐盛，服務人員都能快速提供服務,10.0,台北晶華酒店,Agoda
2021-04-20,價格相對也不低、服務員沒有熱情,,台北晶華酒店,Agoda
2021-04-18,健身房的廁所在健身房外面，要走一下,,台北晶華酒店,Agoda
2021-04-18,很棒住宿體驗,10.0,台北晶華酒店,Agoda
2021-04-18,很棒住宿體驗,10.0,台北晶華酒店,Agoda
2021-04-18,很棒住宿體驗,10.0,台北晶華酒店,Agoda
2021-04-18,品質服務都是不錯，人員服務都很貼心，環境很棒，善待孩童，房間一塵不染，也是第二次來住宿，一直非常滿意，唯一要講的缺點應該是用早餐時人太多了，有點擠爆了,10.0,台北晶華酒店,Agoda
2021-04-13,交通便利的地方,,台北晶華酒店,Agoda
2021-04-12,我是為了早餐而來的！ 選擇超多～好吃，吃好飽！,10.0,台北晶華酒店,Agoda
2021-04-11,早餐超讚啊！,10.0,台北晶華酒店,Agoda
2021-04-10,員工素質佳、專業親切兼具。設施佳、早餐選擇美味豐盛澎湃。雖說房間內桌椅稍為老舊，但是非常整齊清潔。唯一美中不足的是，停車場上大廳只有一部小電梯，常常都要大排長龍。,10.0,台北晶華酒店,Agoda
2021-04-09,"房間45平方公尺,很大了. (2為大人,可議帶2位12歲以下的小孩同住) 自助早餐只有2人份(兒童需依身高量外付費) 衛生用具只有附兩套. 但可以叫送. (免費,但這有點囉唆.入住訂單裏都已經有寫2大1小.) 除了地毯外,都很乾淨. 床,枕頭和棉被都很好(床墊有舒壓墊). 電源插頭有充電器,但是慢充(這樣安全). 浴廁很大,很乾淨. 馬桶有隔間起來. 連沖浴和泡浴也分離(沖浴也有隔起來). 免治馬桶是有加熱墊的. 員工很nice. 屋頂有溫水游泳池,可以免費使用. 但只有提供浴巾. 有躺椅可以躺. 晚上,游泳池旁有放電影. (可惜當天風冷) 有免費健身房,可惜限制16歲以上才能用. 明明有""兵乓球室"",小孩卻不能玩! 我兒子說這規定是""欺侮小孩""! (是不是應該""彈性點""?) 只有健身房有飲水機,但要在房間煮熱水時,不用去取水. 可以叫room service, 會送瓶裝水到房間(免費).",,台北晶華酒店,Agoda
2021-04-08,電影、三溫暖都很棒，惟房內電視建議要能看Netflix,10.0,台北晶華酒店,Agoda
2021-04-08,飯店服務人員非常貼心及細心，房間也非常舒適！很值得再入住,10.0,台北晶華酒店,Agoda
2021-04-07,"目前特價,折扣很划算的五星級飯店,CP值高 可惜去的時間天冷風大 頂樓的游泳池設備未能使用",,台北晶華酒店,Agoda
2021-04-06,從下午五點等到晚上八點才進飯店,,台北晶華酒店,Agoda
2021-04-05,種類眾多，而且肉類很多樣，還有韓式飯捲、擔仔麵、日式冷麵等等，非常值得品嚐，但人很多，需要早點用餐,10.0,台北晶華酒店,Agoda
2021-04-05,游泳池跟兒童遊戲室都很棒！,10.0,台北晶華酒店,Agoda
2021-04-05,退房後未先告知停車場計費方式，，而且櫃台在我們退房時說會給我抵扣2小時停車費，結果取車時並未抵扣，後來付了600多的停車費！感覺不是很好！,,台北晶華酒店,Agoda
2021-04-05,房間大，又有停車場，服務態度親切！ 附近赤峰街 保留古早台北建築，店家營造文青風格的店！ 晶華酒店 地下名品街很有機場免稅商店的fu，頂樓露天游泳池與星空🌃電影院很放鬆啊😌！ 從晶華酒店步行約10分鐘路程的 建成公園 乾淨又好玩！,,台北晶華酒店,Agoda
2021-04-05,房間大也很乾淨。早餐非常好吃。 唯一美中不足的就是 ，沒有適合大童或兒童的設施。,10.0,台北晶華酒店,Agoda
2021-04-04,房間太多桌角（床頭櫃、電視櫃，桌椅⋯⋯）、浴室地板太滑、床也很高，以上想的到的狀況，我家2歲大女兒都發生了！畢竟不是標榜親子房（這次是訂豪華特大），但感謝精心準備嬰兒床&澡盆。,,台北晶華酒店,Agoda
2021-04-04,飯店很用心對待客人，對於住房的備註要求都有完成，雖然外觀有些陳舊感，但裡面提供設施營造氣氛完全符合五星級飯店水準，房間寬敞且乾淨，早餐多元美味！有機會必定回訪！,10.0,台北晶華酒店,Agoda
2021-04-02,房間的冰箱不冰，前一天買的LadyM隔天拿出來讓人傻眼，因為要給小孩吃的，擔心變質，反應過後主管馬上從樓下買了一個表示歉意，真的覺得不愧是五星飯店！,,台北晶華酒店,Agoda
